12:25:26.106 detox[2219] [90mB[39m node_modules/.bin/detox test --configuration android.att.debug --record-logs all
  data: {
    "id": "948e3561-1c60-b61a-5671-804d3aabbb74",
    "detoxConfig": {
      "configurationName": "android.att.debug",
      "apps": {
        "default": {
          "type": "android.apk",
          "binaryPath": "android/app/build/outputs/apk/debug/app-debug.apk",
          "build": "cd android && ./gradlew assembleDebug assembleAndroidTest -DtestBuildType=debug",
          "reversePorts": [
            8081
          ]
        }
      },
      "artifacts": {
        "rootDir": "artifacts/android.att.debug.2023-05-19 06-55-26Z",
        "plugins": {
          "log": {
            "enabled": true,
            "keepOnlyFailedTestsArtifacts": false
          },
          "screenshot": {
            "enabled": true,
            "shouldTakeAutomaticSnapshots": false,
            "keepOnlyFailedTestsArtifacts": false
          },
          "video": {
            "enabled": false,
            "keepOnlyFailedTestsArtifacts": false
          },
          "instruments": {
            "enabled": false,
            "keepOnlyFailedTestsArtifacts": false
          },
          "uiHierarchy": {
            "enabled": false,
            "keepOnlyFailedTestsArtifacts": false
          }
        }
      },
      "behavior": {
        "init": {
          "keepLockFile": false,
          "reinstallApp": true,
          "exposeGlobals": true
        },
        "cleanup": {
          "shutdownDevice": false
        },
        "launchApp": "auto"
      },
      "cli": {
        "recordLogs": "all",
        "configuration": "android.att.debug",
        "start": true
      },
      "device": {
        "type": "android.attached",
        "device": {
          "adbName": ".*"
        }
      },
      "logger": {
        "level": "info",
        "overrideConsole": true,
        "options": {
          "showLoggerName": true,
          "showPid": true,
          "showLevel": false,
          "showMetadata": false,
          "basepath": "/Users/priyaranganathan/Documents/React_Native_Projects/FakeStore/node_modules/detox/src",
          "prefixers": {},
          "stringifiers": {}
        }
      },
      "testRunner": {
        "retries": 0,
        "forwardEnv": false,
        "bail": false,
        "jest": {
          "setupTimeout": 120000,
          "teardownTimeout": 30000,
          "retryAfterCircusRetries": false,
          "reportWorkerAssign": true
        },
        "args": {
          "$0": "jest",
          "_": [],
          "config": "e2e/jest.config.js",
          "--": []
        }
      },
      "session": {
        "autoStart": true,
        "debugSynchronization": 10000
      }
    },
    "detoxIPCServer": "primary-2219",
    "testResults": [],
    "testSessionIndex": 0,
    "workersCount": 0
  }
12:25:26.110 detox[2219] [90mi[39m Server path not specified, so defaulting to ipc.config.socketRoot + ipc.config.appspace + ipc.config.id /tmp/detox.primary-2219
12:25:26.112 detox[2219] [90mi[39m starting server on  /tmp/detox.primary-2219 
12:25:26.112 detox[2219] [90mi[39m starting TLS server false
12:25:26.112 detox[2219] [90mi[39m starting server as Unix || Windows Socket
12:25:26.117 detox[2219] [90mi[39m Detox server listening on localhost:50328...
12:25:26.122 detox[2219] [90mi[39m Serialized the session state at: /private/var/folders/nh/qgcf94bd36j7y52qsksxp38r0000gn/T/948e3561-1c60-b61a-5671-804d3aabbb74.detox.json
12:25:26.124 detox[2219] [90mB[39m jest --config e2e/jest.config.js
12:25:26.682 detox[2220] [90mi[39m Service path not specified, so defaulting to ipc.config.socketRoot + ipc.config.appspace + id 
12:25:26.683 detox[2220] [90mi[39m requested connection to  primary-2219 /tmp/detox.primary-2219
12:25:26.683 detox[2220] [90mi[39m Connecting client on Unix Socket : /tmp/detox.primary-2219
12:25:26.683 detox[2220] [90mi[39m retrying reset
12:25:26.684 detox[2219] [90mi[39m ## socket connection to server detected ##
12:25:26.685 detox[2220] [90mi[39m dispatching event to  primary-2219 /tmp/detox.primary-2219  :  registerContext , { id: 'secondary-2220' }
12:25:26.687 detox[2219] [90mi[39m received event of :  registerContext { id: 'secondary-2220' }
12:25:26.687 detox[2219] [90mi[39m dispatching event to socket  :  registerContextDone { testResults: [], testSessionIndex: 0 }
12:25:26.687 detox[2220] [90mi[39m ## received events ##
12:25:26.687 detox[2220] [90mi[39m detected event registerContextDone { testResults: [], testSessionIndex: 0 }
12:25:26.744 detox[2220] [90mB[39m e2e/starter.test.js
12:25:26.753 detox[2220] [90mB[39m set up environment
12:25:26.758 detox[2220] [90mi[39m dispatching event to  primary-2219 /tmp/detox.primary-2219  :  registerWorker , { workerId: 'w1' }
12:25:26.759 detox[2219] [90mi[39m received event of :  registerWorker { workerId: 'w1' }
12:25:26.759 detox[2219] [90mi[39m dispatching event to socket  :  registerWorkerDone { workersCount: 1 }
12:25:26.759 detox[2219] [90mi[39m broadcasting event to all known sockets listening to  /tmp/detox.primary-2219  :   sessionStateUpdate { workersCount: 1 }
12:25:26.759 detox[2220] [90mi[39m ## received events ##
12:25:26.759 detox[2220] [90mi[39m detected event registerWorkerDone { workersCount: 1 }
12:25:26.870 detox[2220] [90mi[39m ## received events ##
12:25:26.871 detox[2220] [90mi[39m detected event sessionStateUpdate { workersCount: 1 }
12:25:26.876 detox[2219] [90mB[39m connection :50328<->:50329
12:25:26.877 detox[2220] [90mi[39m opened web socket to: ws://localhost:50328
12:25:26.879 detox[2220] [90mi[39m send message
  data: {"type":"login","params":{"sessionId":"ed2cc38e-fd7c-9aa5-b92b-8f99036ec3e1","role":"tester"},"messageId":0}
12:25:26.880 detox[2219] [90mi[39m get
  data: {"type":"login","params":{"sessionId":"ed2cc38e-fd7c-9aa5-b92b-8f99036ec3e1","role":"tester"},"messageId":0}
12:25:26.881 detox[2219] [90mi[39m created session ed2cc38e-fd7c-9aa5-b92b-8f99036ec3e1
12:25:26.881 detox[2219] [90mi[39m send
  data: {
    "type": "loginSuccess",
    "params": {
      "testerConnected": true,
      "appConnected": false
    },
    "messageId": 0
  }
12:25:26.881 detox[2219] [90mi[39m tester joined session ed2cc38e-fd7c-9aa5-b92b-8f99036ec3e1
12:25:26.882 detox[2220] [90mi[39m get message
  data: {"type":"loginSuccess","params":{"testerConnected":true,"appConnected":false},"messageId":0}
   
12:25:26.911 detox[2220] [90mB[39m allocate
  args: ({"type":"android.attached","device":{"adbName":".*"}})
12:25:26.912 detox[2220] [90mi[39m "/Users/priyaranganathan/Library/Android/sdk/platform-tools/adb"  devices
12:25:26.941 detox[2220] [90mi[39m List of devices attached
adb-b6b897f1-BhBLcd._adb-tls-connect._tcp.	device


12:25:26.942 detox[2220] [90mi[39m Found a matching & free device adb-b6b897f1-BhBLcd._adb-tls-connect._tcp.
12:25:26.943 detox[2220] [90mE[39m allocate
12:25:26.943 detox[2220] [90mB[39m postAllocate
  args: ({"adbName":"adb-b6b897f1-BhBLcd._adb-tls-connect._tcp."})
12:25:26.944 detox[2220] [90mi[39m "/Users/priyaranganathan/Library/Android/sdk/platform-tools/adb" -s adb-b6b897f1-BhBLcd._adb-tls-connect._tcp. shell "getprop ro.build.version.sdk"
12:25:27.037 detox[2220] [90mi[39m 30

12:25:27.037 detox[2220] [90mi[39m "/Users/priyaranganathan/Library/Android/sdk/platform-tools/adb" -s adb-b6b897f1-BhBLcd._adb-tls-connect._tcp. shell "dumpsys power | grep \"^[ ]*m[UW].*=\""
12:25:27.252 detox[2220] [90mi[39m   mWakefulness=Awake
  mWakefulnessChanging=false
  mWakeLockSummary=0x0
  mUserActivitySummary=0x1
  mWakeUpWhenPluggedOrUnpluggedConfig=true
  mWakeUpWhenPluggedOrUnpluggedInTheaterModeConfig=false
  mUserActivityTimeoutOverrideFromWindowManager=-1
  mUserInactiveOverrideFromWindowManager=false
  mUserId=0

12:25:27.253 detox[2220] [90mB[39m onBootDevice
  args: ({"deviceId":"adb-b6b897f1-BhBLcd._adb-tls-connect._tcp.","type":"device","coldBoot":false})
12:25:27.254 detox[2220] [90mE[39m onBootDevice
12:25:27.254 detox[2220] [90mE[39m postAllocate
12:25:27.285 detox[2220] [90mB[39m installUtilBinaries
  args: ()
12:25:27.285 detox[2220] [90mE[39m installUtilBinaries
12:25:27.286 detox[2220] [90mB[39m selectApp
  args: ("default")
12:25:27.294 detox[2220] [90mi[39m "/Users/priyaranganathan/Library/Android/sdk/build-tools/33.0.0/aapt" dump badging "/Users/priyaranganathan/Documents/React_Native_Projects/FakeStore/android/app/build/outputs/apk/debug/app-debug.apk"
12:25:27.329 detox[2220] [90mi[39m package: name='com.fakestore' versionCode='1' versionName='1.0' platformBuildVersionName='12' platformBuildVersionCode='31' compileSdkVersion='31' compileSdkVersionCodename='12'
sdkVersion:'21'
targetSdkVersion:'31'
uses-permission: name='android.permission.SYSTEM_ALERT_WINDOW'
uses-permission: name='android.permission.INTERNET'
uses-permission: name='android.permission.CAMERA'
uses-permission: name='android.permission.WRITE_EXTERNAL_STORAGE'
uses-permission: name='android.permission.ACCESS_FINE_LOCATION'
uses-permission: name='android.permission.ACCESS_COARSE_LOCATION'
uses-permission: name='android.permission.ACCESS_WIFI_STATE'
application-label:'FakeStore'
application-label-af:'FakeStore'
application-label-am:'FakeStore'
application-label-ar:'FakeStore'
application-label-as:'FakeStore'
application-label-az:'FakeStore'
application-label-be:'FakeStore'
application-label-bg:'FakeStore'
application-label-bn:'FakeStore'
application-label-bs:'FakeStore'
application-label-ca:'FakeStore'
application-label-cs:'FakeStore'
application-label-da:'FakeStore'
application-label-de:'FakeStore'
application-label-el:'FakeStore'
application-label-en-AU:'FakeStore'
application-label-en-CA:'FakeStore'
application-label-en-GB:'FakeStore'
application-label-en-IN:'FakeStore'
application-label-en-XC:'FakeStore'
application-label-es:'FakeStore'
application-label-es-US:'FakeStore'
application-label-et:'FakeStore'
application-label-eu:'FakeStore'
application-label-fa:'FakeStore'
application-label-fi:'FakeStore'
application-label-fr:'FakeStore'
application-label-fr-CA:'FakeStore'
application-label-gl:'FakeStore'
application-label-gu:'FakeStore'
application-label-hi:'FakeStore'
application-label-hr:'FakeStore'
application-label-hu:'FakeStore'
application-label-hy:'FakeStore'
application-label-in:'FakeStore'
application-label-is:'FakeStore'
application-label-it:'FakeStore'
application-label-iw:'FakeStore'
application-label-ja:'FakeStore'
application-label-ka:'FakeStore'
application-label-kk:'FakeStore'
application-label-km:'FakeStore'
application-label-kn:'FakeStore'
application-label-ko:'FakeStore'
application-label-ky:'FakeStore'
application-label-lo:'FakeStore'
application-label-lt:'FakeStore'
application-label-lv:'FakeStore'
application-label-mk:'FakeStore'
application-label-ml:'FakeStore'
application-label-mn:'FakeStore'
application-label-mr:'FakeStore'
application-label-ms:'FakeStore'
application-label-my:'FakeStore'
application-label-nb:'FakeStore'
application-label-ne:'FakeStore'
application-label-nl:'FakeStore'
application-label-or:'FakeStore'
application-label-pa:'FakeStore'
application-label-pl:'FakeStore'
application-label-pt:'FakeStore'
application-label-pt-BR:'FakeStore'
application-label-pt-PT:'FakeStore'
application-label-ro:'FakeStore'
application-label-ru:'FakeStore'
application-label-si:'FakeStore'
application-label-sk:'FakeStore'
application-label-sl:'FakeStore'
application-label-sq:'FakeStore'
application-label-sr:'FakeStore'
application-label-sr-Latn:'FakeStore'
application-label-sv:'FakeStore'
application-label-sw:'FakeStore'
application-label-ta:'FakeStore'
application-label-te:'FakeStore'
application-label-th:'FakeStore'
application-label-tl:'FakeStore'
application-label-tr:'FakeStore'
application-label-uk:'FakeStore'
application-label-ur:'FakeStore'
application-label-uz:'FakeStore'
application-label-vi:'FakeStore'
application-label-zh-CN:'FakeStore'
application-label-zh-HK:'FakeStore'
application-label-zh-TW:'FakeStore'
application-label-zu:'FakeStore'
application-icon-160:'res/mipmap-mdpi-v4/ic_launcher.png'
application-icon-240:'res/mipmap-hdpi-v4/ic_launcher.png'
application-icon-320:'res/mipmap-xhdpi-v4/ic_launcher.png'
application-icon-480:'res/mipmap-xxhdpi-v4/ic_launcher.png'
application-icon-640:'res/mipmap-xxxhdpi-v4/ic_launcher.png'
application-icon-65534:'res/mipmap-mdpi-v4/ic_launcher.png'
application: label='FakeStore' icon='res/mipmap-mdpi-v4/ic_launcher.png'
application-debuggable
launchable-activity: name='com.fakestore.MainActivity'  label='FakeStore' icon=''
uses-permission: name='android.permission.READ_EXTERNAL_STORAGE'
uses-implied-permission: name='android.permission.READ_EXTERNAL_STORAGE' reason='requested WRITE_EXTERNAL_STORAGE'
feature-group: label=''
  uses-feature: name='android.hardware.camera'
  uses-implied-feature: name='android.hardware.camera' reason='requested android.permission.CAMERA permission'
  uses-feature: name='android.hardware.faketouch'
  uses-implied-feature: name='android.hardware.faketouch' reason='default feature for all apps'
  uses-feature: name='android.hardware.location'
  uses-implied-feature: name='android.hardware.location' reason='requested android.permission.ACCESS_COARSE_LOCATION permission, and requested android.permission.ACCESS_FINE_LOCATION permission'
  uses-feature: name='android.hardware.wifi'
  uses-implied-feature: name='android.hardware.wifi' reason='requested android.permission.ACCESS_WIFI_STATE permission'
main
other-activities
supports-screens: 'small' 'normal' 'large' 'xlarge'
supports-any-density: 'true'
locales: '--_--' 'af' 'am' 'ar' 'as' 'az' 'be' 'bg' 'bn' 'bs' 'ca' 'cs' 'da' 'de' 'el' 'en-AU' 'en-CA' 'en-GB' 'en-IN' 'en-XC' 'es' 'es-US' 'et' 'eu' 'fa' 'fi' 'fr' 'fr-CA' 'gl' 'gu' 'hi' 'hr' 'hu' 'hy' 'in' 'is' 'it' 'iw' 'ja' 'ka' 'kk' 'km' 'kn' 'ko' 'ky' 'lo' 'lt' 'lv' 'mk' 'ml' 'mn' 'mr' 'ms' 'my' 'nb' 'ne' 'nl' 'or' 'pa' 'pl' 'pt' 'pt-BR' 'pt-PT' 'ro' 'ru' 'si' 'sk' 'sl' 'sq' 'sr' 'sr-Latn' 'sv' 'sw' 'ta' 'te' 'th' 'tl' 'tr' 'uk' 'ur' 'uz' 'vi' 'zh-CN' 'zh-HK' 'zh-TW' 'zu'
densities: '160' '240' '320' '480' '640' '65534'
native-code: 'arm64-v8a' 'armeabi-v7a' 'x86' 'x86_64'

12:25:27.330 detox[2220] [90mE[39m selectApp
12:25:27.330 detox[2220] [90mB[39m uninstallApp
  args: ()
12:25:27.330 detox[2220] [90mB[39m onBeforeUninstallApp
  args: ({"deviceId":"adb-b6b897f1-BhBLcd._adb-tls-connect._tcp.","bundleId":"com.fakestore"})
12:25:27.331 detox[2220] [90mE[39m onBeforeUninstallApp
12:25:27.331 detox[2220] [90mi[39m "/Users/priyaranganathan/Library/Android/sdk/platform-tools/adb" -s adb-b6b897f1-BhBLcd._adb-tls-connect._tcp. shell "pm list packages com.fakestore"
12:25:27.504 detox[2220] [90mi[39m package:com.fakestore.test
package:com.fakestore

12:25:27.505 detox[2220] [90mi[39m "/Users/priyaranganathan/Library/Android/sdk/platform-tools/adb" -s adb-b6b897f1-BhBLcd._adb-tls-connect._tcp. uninstall com.fakestore
12:25:28.274 detox[2220] [90mi[39m Success

12:25:28.274 detox[2220] [90mi[39m "/Users/priyaranganathan/Library/Android/sdk/platform-tools/adb" -s adb-b6b897f1-BhBLcd._adb-tls-connect._tcp. shell "pm list packages com.fakestore.test"
12:25:28.437 detox[2220] [90mi[39m package:com.fakestore.test

12:25:28.437 detox[2220] [90mi[39m "/Users/priyaranganathan/Library/Android/sdk/platform-tools/adb" -s adb-b6b897f1-BhBLcd._adb-tls-connect._tcp. uninstall com.fakestore.test
12:25:30.138 detox[2220] [90mi[39m Success

12:25:30.138 detox[2220] [90mE[39m uninstallApp
12:25:30.140 detox[2220] [90mB[39m selectApp
  args: ("default")
12:25:30.142 detox[2220] [90mB[39m terminateApp
  args: ()
12:25:30.142 detox[2220] [90mB[39m onBeforeTerminateApp
  args: ({"deviceId":"adb-b6b897f1-BhBLcd._adb-tls-connect._tcp.","bundleId":"com.fakestore"})
12:25:30.143 detox[2220] [90mE[39m onBeforeTerminateApp
12:25:30.143 detox[2220] [90mi[39m "/Users/priyaranganathan/Library/Android/sdk/platform-tools/adb" -s adb-b6b897f1-BhBLcd._adb-tls-connect._tcp. shell "am force-stop com.fakestore"
12:25:30.320 detox[2220] [90mi[39m 
12:25:30.320 detox[2220] [90mB[39m onTerminateApp
  args: ({"deviceId":"adb-b6b897f1-BhBLcd._adb-tls-connect._tcp.","bundleId":"com.fakestore"})
12:25:30.321 detox[2220] [90mE[39m onTerminateApp
12:25:30.321 detox[2220] [90mE[39m terminateApp
12:25:30.321 detox[2220] [90mE[39m selectApp
12:25:30.322 detox[2220] [90mB[39m installApp
  args: ()
12:25:30.323 detox[2220] [90mi[39m "/Users/priyaranganathan/Library/Android/sdk/build-tools/33.0.0/aapt" dump xmlstrings "/Users/priyaranganathan/Documents/React_Native_Projects/FakeStore/android/app/build/outputs/apk/debug/app-debug.apk" AndroidManifest.xml
12:25:30.368 detox[2220] [90mi[39m String pool of 63 unique UTF-16 non-sorted strings, 63 entries and 0 styles using 3000 bytes:
String #0: theme
String #1: label
String #2: icon
String #3: name
String #4: debuggable
String #5: exported
String #6: authorities
String #7: grantUriPermissions
String #8: launchMode
String #9: configChanges
String #10: value
String #11: resource
String #12: minSdkVersion
String #13: versionCode
String #14: versionName
String #15: windowSoftInputMode
String #16: targetSdkVersion
String #17: allowBackup
String #18: usesCleartextTraffic
String #19: networkSecurityConfig
String #20: roundIcon
String #21: compileSdkVersion
String #22: compileSdkVersionCodename
String #23: appComponentFactory
String #24: 1.0
String #25: 12
String #26: action
String #27: activity
String #28: android
String #29: android.intent.action.MAIN
String #30: android.intent.category.LAUNCHER
String #31: android.permission.ACCESS_COARSE_LOCATION
String #32: android.permission.ACCESS_FINE_LOCATION
String #33: android.permission.ACCESS_WIFI_STATE
String #34: android.permission.CAMERA
String #35: android.permission.INTERNET
String #36: android.permission.SYSTEM_ALERT_WINDOW
String #37: android.permission.WRITE_EXTERNAL_STORAGE
String #38: android.support.FILE_PROVIDER_PATHS
String #39: androidx.core.app.CoreComponentFactory
String #40: androidx.emoji2.text.EmojiCompatInitializer
String #41: androidx.lifecycle.ProcessLifecycleInitializer
String #42: androidx.startup
String #43: androidx.startup.InitializationProvider
String #44: application
String #45: category
String #46: com.facebook.react.devsupport.DevSettingsActivity
String #47: com.fakestore
String #48: com.fakestore.MainActivity
String #49: com.fakestore.MainApplication
String #50: com.fakestore.androidx-startup
String #51: com.fakestore.imagepickerprovider
String #52: com.imagepicker.ImagePickerProvider
String #53: http://schemas.android.com/apk/res/android
String #54: intent-filter
String #55: manifest
String #56: meta-data
String #57: package
String #58: platformBuildVersionCode
String #59: platformBuildVersionName
String #60: provider
String #61: uses-permission
String #62: uses-sdk

12:25:30.368 detox[2220] [90mi[39m "/Users/priyaranganathan/Library/Android/sdk/build-tools/33.0.0/aapt" dump xmlstrings "/Users/priyaranganathan/Documents/React_Native_Projects/FakeStore/android/app/build/outputs/apk/androidTest/debug/app-debug-androidTest.apk" AndroidManifest.xml
12:25:30.396 detox[2220] [90mi[39m String pool of 42 unique UTF-16 non-sorted strings, 42 entries and 0 styles using 2060 bytes:
String #0: theme
String #1: label
String #2: name
String #3: debuggable
String #4: exported
String #5: priority
String #6: targetPackage
String #7: handleProfiling
String #8: functionalTest
String #9: minSdkVersion
String #10: targetSdkVersion
String #11: compileSdkVersion
String #12: compileSdkVersionCodename
String #13: 12
String #14: Tests for com.fakestore
String #15: activity
String #16: android
String #17: android.intent.category.LAUNCHER
String #18: android.permission.REORDER_TASKS
String #19: android.test.runner
String #20: androidx.test.core.app.InstrumentationActivityInvoker$BootstrapActivity
String #21: androidx.test.core.app.InstrumentationActivityInvoker$EmptyActivity
String #22: androidx.test.core.app.InstrumentationActivityInvoker$EmptyFloatingActivity
String #23: androidx.test.orchestrator
String #24: androidx.test.runner.AndroidJUnitRunner
String #25: androidx.test.services
String #26: application
String #27: category
String #28: com.fakestore
String #29: com.fakestore.test
String #30: com.google.android.apps.common.testing.services
String #31: http://schemas.android.com/apk/res/android
String #32: instrumentation
String #33: intent-filter
String #34: manifest
String #35: package
String #36: platformBuildVersionCode
String #37: platformBuildVersionName
String #38: queries
String #39: uses-library
String #40: uses-permission
String #41: uses-sdk

12:25:30.404 detox[2220] [90mi[39m /Users/priyaranganathan/Library/Android/sdk/platform-tools/adb -s adb-b6b897f1-BhBLcd._adb-tls-connect._tcp. install -r -g -t /Users/priyaranganathan/Documents/React_Native_Projects/FakeStore/android/app/build/outputs/apk/debug/app-debug.apk
12:25:45.437 detox[2220] [90mi[39m Performing Streamed Install
Success

12:25:45.442 detox[2220] [90mi[39m /Users/priyaranganathan/Library/Android/sdk/platform-tools/adb -s adb-b6b897f1-BhBLcd._adb-tls-connect._tcp. install -r -g -t /Users/priyaranganathan/Documents/React_Native_Projects/FakeStore/android/app/build/outputs/apk/debug/app-debug.apk exited with code #0
12:25:45.460 detox[2220] [90mi[39m /Users/priyaranganathan/Library/Android/sdk/platform-tools/adb -s adb-b6b897f1-BhBLcd._adb-tls-connect._tcp. install -r -g -t /Users/priyaranganathan/Documents/React_Native_Projects/FakeStore/android/app/build/outputs/apk/androidTest/debug/app-debug-androidTest.apk
12:25:48.543 detox[2220] [90mi[39m Performing Streamed Install
Success

12:25:48.549 detox[2220] [90mi[39m /Users/priyaranganathan/Library/Android/sdk/platform-tools/adb -s adb-b6b897f1-BhBLcd._adb-tls-connect._tcp. install -r -g -t /Users/priyaranganathan/Documents/React_Native_Projects/FakeStore/android/app/build/outputs/apk/androidTest/debug/app-debug-androidTest.apk exited with code #0
12:25:48.551 detox[2220] [90mB[39m reverseTcpPort
  args: (8081)
12:25:48.552 detox[2220] [90mi[39m "/Users/priyaranganathan/Library/Android/sdk/platform-tools/adb" -s adb-b6b897f1-BhBLcd._adb-tls-connect._tcp. reverse tcp:8081 tcp:8081
12:25:48.614 detox[2220] [90mi[39m 
12:25:48.614 detox[2220] [90mE[39m reverseTcpPort
12:25:48.615 detox[2220] [90mE[39m installApp
12:25:48.615 detox[2220] [90mB[39m selectApp
  args: ("default")
12:25:48.615 detox[2220] [90mB[39m terminateApp
  args: ()
12:25:48.615 detox[2220] [90mB[39m onBeforeTerminateApp
  args: ({"deviceId":"adb-b6b897f1-BhBLcd._adb-tls-connect._tcp.","bundleId":"com.fakestore"})
12:25:48.615 detox[2220] [90mE[39m onBeforeTerminateApp
12:25:48.616 detox[2220] [90mi[39m "/Users/priyaranganathan/Library/Android/sdk/platform-tools/adb" -s adb-b6b897f1-BhBLcd._adb-tls-connect._tcp. shell "am force-stop com.fakestore"
12:25:48.816 detox[2220] [90mi[39m 
12:25:48.816 detox[2220] [90mB[39m onTerminateApp
  args: ({"deviceId":"adb-b6b897f1-BhBLcd._adb-tls-connect._tcp.","bundleId":"com.fakestore"})
12:25:48.816 detox[2220] [90mE[39m onTerminateApp
12:25:48.817 detox[2220] [90mE[39m terminateApp
12:25:48.817 detox[2220] [90mE[39m selectApp
12:25:48.818 detox[2220] [90mE[39m set up environment
12:25:49.135 detox[2220] [90mi[39m starter.test.js is assigned to AttachedDevice:adb-b6b897f1-BhBLcd._adb-tls-connect._tcp.
12:25:49.136 detox[2220] [90mB[39m run the tests
12:25:49.136 detox[2220] [90mB[39m onRunDescribeStart
  args: ({"name":"ROOT_DESCRIBE_BLOCK"})
12:25:49.137 detox[2220] [90mE[39m onRunDescribeStart
12:25:49.138 detox[2220] [90mB[39m Example
12:25:49.138 detox[2220] [90mB[39m onRunDescribeStart
  args: ({"name":"Example"})
12:25:49.138 detox[2220] [90mE[39m onRunDescribeStart
12:25:49.138 detox[2220] [90mB[39m beforeAll
12:25:49.142 detox[2220] [90mB[39m launchApp
  args: ()
12:25:49.143 detox[2220] [90mB[39m terminateApp
  args: ("com.fakestore")
12:25:49.143 detox[2220] [90mB[39m onBeforeTerminateApp
  args: ({"deviceId":"adb-b6b897f1-BhBLcd._adb-tls-connect._tcp.","bundleId":"com.fakestore"})
12:25:49.143 detox[2220] [90mE[39m onBeforeTerminateApp
12:25:49.143 detox[2220] [90mi[39m "/Users/priyaranganathan/Library/Android/sdk/platform-tools/adb" -s adb-b6b897f1-BhBLcd._adb-tls-connect._tcp. shell "am force-stop com.fakestore"
12:25:49.338 detox[2220] [90mi[39m 
12:25:49.338 detox[2220] [90mB[39m onTerminateApp
  args: ({"deviceId":"adb-b6b897f1-BhBLcd._adb-tls-connect._tcp.","bundleId":"com.fakestore"})
12:25:49.338 detox[2220] [90mE[39m onTerminateApp
12:25:49.339 detox[2220] [90mE[39m terminateApp
12:25:49.341 detox[2220] [90mB[39m onBeforeLaunchApp
  args: ({"deviceId":"adb-b6b897f1-BhBLcd._adb-tls-connect._tcp.","bundleId":"com.fakestore","launchArgs":{"detoxServer":"ws://localhost:50328","detoxSessionId":"ed2cc38e-fd7c-9aa5-b92b-8f99036ec3e1"}})
12:25:49.341 detox[2220] [90mi[39m "/Users/priyaranganathan/Library/Android/sdk/platform-tools/adb" -s adb-b6b897f1-BhBLcd._adb-tls-connect._tcp. shell "date +\"%m-%d %T.000\""
12:25:49.440 detox[2220] [90mi[39m 05-19 12:25:47.000

12:25:49.440 detox[2220] [90mE[39m onBeforeLaunchApp
12:25:49.441 detox[2220] [90mi[39m "/Users/priyaranganathan/Library/Android/sdk/platform-tools/adb" -s adb-b6b897f1-BhBLcd._adb-tls-connect._tcp. reverse tcp:50328 tcp:50328
12:25:49.485 detox[2220] [90mi[39m 50328

12:25:49.486 detox[2220] [90mi[39m "/Users/priyaranganathan/Library/Android/sdk/platform-tools/adb" -s adb-b6b897f1-BhBLcd._adb-tls-connect._tcp. shell "pm list instrumentation"
12:25:49.619 detox[2220] [90mi[39m instrumentation:com.fakestore.test/androidx.test.runner.AndroidJUnitRunner (target=com.fakestore)

12:25:49.631 detox[2220] [90mi[39m /Users/priyaranganathan/Library/Android/sdk/platform-tools/adb -s adb-b6b897f1-BhBLcd._adb-tls-connect._tcp. shell am instrument -w -r -e detoxServer ws://localhost:50328 -e detoxSessionId ed2cc38e-fd7c-9aa5-b92b-8f99036ec3e1 -e debug false com.fakestore.test/androidx.test.runner.AndroidJUnitRunner
12:25:50.135 detox[2220] [90mi[39m "/Users/priyaranganathan/Library/Android/sdk/platform-tools/adb" -s adb-b6b897f1-BhBLcd._adb-tls-connect._tcp. shell "ps | grep \"com\.fakestore$\""
12:25:50.348 detox[2220] [90mi[39m u0_a1017      17720    951 5829688 126276 0                   0 R com.fakestore

12:25:50.349 detox[2220] [90mB[39m onLaunchApp
  args: ({"deviceId":"adb-b6b897f1-BhBLcd._adb-tls-connect._tcp.","bundleId":"com.fakestore","launchArgs":{"detoxServer":"ws://localhost:50328","detoxSessionId":"ed2cc38e-fd7c-9aa5-b92b-8f99036ec3e1"},"pid":17720})
12:25:50.351 detox[2220] [90mi[39m starting ADBLogcatRecording
12:25:50.368 detox[2220] [90mi[39m /Users/priyaranganathan/Library/Android/sdk/platform-tools/adb -s adb-b6b897f1-BhBLcd._adb-tls-connect._tcp. shell "logcat -T \"05-19 12:25:47.000\" --pid=17720 -f /sdcard/122526905_0.log"
12:25:50.368 detox[2220] [90mE[39m onLaunchApp
12:25:50.670 detox[2220] [90mi[39m "/Users/priyaranganathan/Library/Android/sdk/platform-tools/adb" -s adb-b6b897f1-BhBLcd._adb-tls-connect._tcp. shell du /sdcard/122526905_0.log
12:25:50.804 detox[2220] [90mi[39m 4	/sdcard/122526905_0.log

12:25:51.660 detox[2220] [90mi[39m INSTRUMENTATION_STATUS: class=com.fakestore.DetoxTest
INSTRUMENTATION_STATUS: current=1
INSTRUMENTATION_STATUS: id=AndroidJUnitRunner
INSTRUMENTATION_STATUS: numtests=1
INSTRUMENTATION_STATUS: stream=
com.fakestore.DetoxTest:
INSTRUMENTATION_STATUS: test=runDetoxTests
INSTRUMENTATION_STATUS_CODE: 1

12:25:52.555 detox[2219] [90mB[39m connection :50328<->:50392
12:25:52.796 detox[2219] [90mi[39m get
  data: {"messageId":0,"type":"login","params":{"role":"app","sessionId":"ed2cc38e-fd7c-9aa5-b92b-8f99036ec3e1"}}
12:25:52.798 detox[2219] [90mi[39m send
  data: {
    "messageId": 0,
    "type": "loginSuccess",
    "params": {
      "testerConnected": true,
      "appConnected": true
    }
  }
12:25:52.799 detox[2219] [90mi[39m app joined session ed2cc38e-fd7c-9aa5-b92b-8f99036ec3e1
12:25:52.799 detox[2219] [90mi[39m send
  data: {
    "type": "appConnected"
  }
12:25:52.802 detox[2220] [90mi[39m get message
  data: {"type":"appConnected"}
   
12:25:52.809 detox[2220] [90mi[39m send message
  data: {"type":"isReady","params":{},"messageId":-1000}
12:25:52.811 detox[2219] [90mi[39m get
  data: {"type":"isReady","params":{},"messageId":-1000}
12:25:52.811 detox[2219] [90mi[39m send
  data: {
    "type": "isReady",
    "params": {},
    "messageId": -1000
  }
12:25:54.413 detox[2219] [90mi[39m get
  data: {"messageId":-1000,"type":"ready","params":{}}
12:25:54.414 detox[2219] [90mi[39m send
  data: {
    "messageId": -1000,
    "type": "ready",
    "params": {}
  }
12:25:54.414 detox[2220] [90mi[39m get message
  data: {"messageId":-1000,"type":"ready","params":{}}
   
12:25:54.416 detox[2220] [90mB[39m onAppReady
  args: ({"deviceId":"adb-b6b897f1-BhBLcd._adb-tls-connect._tcp.","bundleId":"com.fakestore","pid":17720})
12:25:54.417 detox[2220] [90mE[39m onAppReady
12:25:54.417 detox[2220] [90mE[39m launchApp
12:25:54.417 detox[2220] [90mE[39m beforeAll
12:25:54.418 detox[2220] [90mB[39m should have splash screen
12:25:54.419 detox[2220] [90mi[39m Example: should have splash screen
12:25:54.421 detox[2220] [90mB[39m onTestStart
  args: ({"title":"should have splash screen","fullName":"Example should have splash screen","status":"running","invocations":1})
12:25:54.421 detox[2220] [90mi[39m stopping ADBLogcatRecording
12:25:54.422 detox[2220] [90mi[39m "/Users/priyaranganathan/Library/Android/sdk/platform-tools/adb" -s adb-b6b897f1-BhBLcd._adb-tls-connect._tcp. shell "date +\"%m-%d %T.000\""
12:25:54.433 detox[2219] [90mi[39m get
  data: {"messageId":-1000,"type":"ready","params":{}}
12:25:54.433 detox[2219] [90mi[39m send
  data: {
    "messageId": -1000,
    "type": "ready",
    "params": {}
  }
12:25:54.437 detox[2220] [90mi[39m get message
  data: {"messageId":-1000,"type":"ready","params":{}}
   
12:25:54.547 detox[2220] [90mi[39m 05-19 12:25:52.000

12:25:54.549 detox[2220] [90mi[39m sending SIGINT to: /Users/priyaranganathan/Library/Android/sdk/platform-tools/adb -s adb-b6b897f1-BhBLcd._adb-tls-connect._tcp. shell logcat -T "05-19 12:25:47.000" --pid=17720 -f /sdcard/122526905_0.log
12:25:54.552 detox[2220] [90mi[39m /Users/priyaranganathan/Library/Android/sdk/platform-tools/adb -s adb-b6b897f1-BhBLcd._adb-tls-connect._tcp. shell "logcat -T \"05-19 12:25:47.000\" --pid=17720 -f /sdcard/122526905_0.log" terminated with SIGINT
12:25:54.552 detox[2220] [90mi[39m starting ADBLogcatRecording
12:25:54.562 detox[2220] [90mi[39m /Users/priyaranganathan/Library/Android/sdk/platform-tools/adb -s adb-b6b897f1-BhBLcd._adb-tls-connect._tcp. shell "logcat -T \"05-19 12:25:52.000\" --pid=17720 -f /sdcard/122526905_1.log"
12:25:54.562 detox[2220] [90mE[39m onTestStart
12:25:54.562 detox[2220] [90mB[39m beforeEach
12:25:54.563 detox[2220] [90mE[39m beforeEach
12:25:54.563 detox[2220] [90mB[39m beforeEach
12:25:54.564 detox[2220] [90mB[39m reloadReactNative
  args: ()
12:25:54.565 detox[2220] [90mi[39m send message
  data: {"type":"reactNativeReload","params":{},"messageId":-1000}
12:25:54.566 detox[2219] [90mi[39m get
  data: {"type":"reactNativeReload","params":{},"messageId":-1000}
12:25:54.566 detox[2219] [90mi[39m send
  data: {
    "type": "reactNativeReload",
    "params": {},
    "messageId": -1000
  }
12:25:54.863 detox[2220] [90mi[39m "/Users/priyaranganathan/Library/Android/sdk/platform-tools/adb" -s adb-b6b897f1-BhBLcd._adb-tls-connect._tcp. shell du /sdcard/122526905_1.log
12:25:54.987 detox[2220] [90mi[39m 4	/sdcard/122526905_1.log

12:25:56.298 detox[2219] [90mi[39m get
  data: {"messageId":-1000,"type":"ready","params":{}}
12:25:56.298 detox[2219] [90mi[39m send
  data: {
    "messageId": -1000,
    "type": "ready",
    "params": {}
  }
12:25:56.300 detox[2220] [90mi[39m get message
  data: {"messageId":-1000,"type":"ready","params":{}}
   
12:25:56.301 detox[2220] [90mE[39m reloadReactNative
12:25:56.302 detox[2220] [90mE[39m beforeEach
12:25:56.303 detox[2220] [90mB[39m test_fn
12:25:56.310 detox[2220] [90mi[39m send message
  data: {"type":"invoke","params":{"target":{"type":"Class","value":"com.wix.detox.espresso.DetoxAssertion"},"method":"waitForAssertMatcher","args":[{"type":"Invocation","value":{"target":{"type":"Class","value":"androidx.test.espresso.Espresso"},"method":"onView","args":[{"type":"Invocation","value":{"target":{"type":"Class","value":"com.wix.detox.espresso.DetoxMatcher"},"method":"matcherForText","args":["Fake Store"]}}]}},{"type":"Invocation","value":{"target":{"type":"Class","value":"com.wix.detox.espresso.DetoxMatcher"},"method":"matcherForSufficientlyVisible","args":[{"type":"Integer","value":75}]}},{"type":"Double","value":5}]},"messageId":1}
12:25:56.312 detox[2219] [90mi[39m get
  data: {"type":"invoke","params":{"target":{"type":"Class","value":"com.wix.detox.espresso.DetoxAssertion"},"method":"waitForAssertMatcher","args":[{"type":"Invocation","value":{"target":{"type":"Class","value":"androidx.test.espresso.Espresso"},"method":"onView","args":[{"type":"Invocation","value":{"target":{"type":"Class","value":"com.wix.detox.espresso.DetoxMatcher"},"method":"matcherForText","args":["Fake Store"]}}]}},{"type":"Invocation","value":{"target":{"type":"Class","value":"com.wix.detox.espresso.DetoxMatcher"},"method":"matcherForSufficientlyVisible","args":[{"type":"Integer","value":75}]}},{"type":"Double","value":5}]},"messageId":1}
12:25:56.312 detox[2219] [90mi[39m send
  data: {
    "type": "invoke",
    "params": {
      "target": {
        "type": "Class",
        "value": "com.wix.detox.espresso.DetoxAssertion"
      },
      "method": "waitForAssertMatcher",
      "args": [
        {
          "type": "Invocation",
          "value": {
            "target": {
              "type": "Class",
              "value": "androidx.test.espresso.Espresso"
            },
            "method": "onView",
            "args": [
              {
                "type": "Invocation",
                "value": {
                  "target": {
                    "type": "Class",
                    "value": "com.wix.detox.espresso.DetoxMatcher"
                  },
                  "method": "matcherForText",
                  "args": [
                    "Fake Store"
                  ]
                }
              }
            ]
          }
        },
        {
          "type": "Invocation",
          "value": {
            "target": {
              "type": "Class",
              "value": "com.wix.detox.espresso.DetoxMatcher"
            },
            "method": "matcherForSufficientlyVisible",
            "args": [
              {
                "type": "Integer",
                "value": 75
              }
            ]
          }
        },
        {
          "type": "Double",
          "value": 5
        }
      ]
    },
    "messageId": 1
  }
12:25:56.314 detox[2220] [90mB[39m undefined with timeout (5000 ms)
  data: {
    "target": {
      "type": "Class",
      "value": "com.wix.detox.espresso.DetoxAssertion"
    },
    "method": "waitForAssertMatcher",
    "args": [
      {
        "type": "Invocation",
        "value": {
          "target": {
            "type": "Class",
            "value": "androidx.test.espresso.Espresso"
          },
          "method": "onView",
          "args": [
            {
              "type": "Invocation",
              "value": {
                "target": {
                  "type": "Class",
                  "value": "com.wix.detox.espresso.DetoxMatcher"
                },
                "method": "matcherForText",
                "args": [
                  "Fake Store"
                ]
              }
            }
          ]
        }
      },
      {
        "type": "Invocation",
        "value": {
          "target": {
            "type": "Class",
            "value": "com.wix.detox.espresso.DetoxMatcher"
          },
          "method": "matcherForSufficientlyVisible",
          "args": [
            {
              "type": "Integer",
              "value": 75
            }
          ]
        }
      },
      {
        "type": "Double",
        "value": 5
      }
    ]
  }
12:25:57.105 detox[2219] [90mi[39m get
  data: {"messageId":1,"type":"invokeResult","params":{"result":null}}
12:25:57.105 detox[2219] [90mi[39m send
  data: {
    "messageId": 1,
    "type": "invokeResult",
    "params": {
      "result": null
    }
  }
12:25:57.105 detox[2220] [90mi[39m get message
  data: {"messageId":1,"type":"invokeResult","params":{"result":null}}
   
12:25:57.106 detox[2220] [90mE[39m undefined with timeout (5000 ms)
12:25:57.109 detox[2220] [90mi[39m send message
  data: {"type":"invoke","params":{"target":{"type":"Class","value":"com.wix.detox.espresso.DetoxAssertion"},"method":"assertMatcher","args":[{"type":"Invocation","value":{"target":{"type":"Class","value":"androidx.test.espresso.Espresso"},"method":"onView","args":[{"type":"Invocation","value":{"target":{"type":"Class","value":"com.wix.detox.espresso.DetoxMatcher"},"method":"matcherForText","args":["Find your Gadget"]}}]}},{"type":"Invocation","value":{"target":{"type":"Class","value":"com.wix.detox.espresso.DetoxMatcher"},"method":"matcherForSufficientlyVisible","args":[{"type":"Integer","value":75}]}}]},"messageId":2}
12:25:57.110 detox[2219] [90mi[39m get
  data: {"type":"invoke","params":{"target":{"type":"Class","value":"com.wix.detox.espresso.DetoxAssertion"},"method":"assertMatcher","args":[{"type":"Invocation","value":{"target":{"type":"Class","value":"androidx.test.espresso.Espresso"},"method":"onView","args":[{"type":"Invocation","value":{"target":{"type":"Class","value":"com.wix.detox.espresso.DetoxMatcher"},"method":"matcherForText","args":["Find your Gadget"]}}]}},{"type":"Invocation","value":{"target":{"type":"Class","value":"com.wix.detox.espresso.DetoxMatcher"},"method":"matcherForSufficientlyVisible","args":[{"type":"Integer","value":75}]}}]},"messageId":2}
12:25:57.110 detox[2219] [90mi[39m send
  data: {
    "type": "invoke",
    "params": {
      "target": {
        "type": "Class",
        "value": "com.wix.detox.espresso.DetoxAssertion"
      },
      "method": "assertMatcher",
      "args": [
        {
          "type": "Invocation",
          "value": {
            "target": {
              "type": "Class",
              "value": "androidx.test.espresso.Espresso"
            },
            "method": "onView",
            "args": [
              {
                "type": "Invocation",
                "value": {
                  "target": {
                    "type": "Class",
                    "value": "com.wix.detox.espresso.DetoxMatcher"
                  },
                  "method": "matcherForText",
                  "args": [
                    "Find your Gadget"
                  ]
                }
              }
            ]
          }
        },
        {
          "type": "Invocation",
          "value": {
            "target": {
              "type": "Class",
              "value": "com.wix.detox.espresso.DetoxMatcher"
            },
            "method": "matcherForSufficientlyVisible",
            "args": [
              {
                "type": "Integer",
                "value": 75
              }
            ]
          }
        }
      ]
    },
    "messageId": 2
  }
12:25:57.110 detox[2220] [90mB[39m expect element to be visible
  data: {
    "target": {
      "type": "Class",
      "value": "com.wix.detox.espresso.DetoxAssertion"
    },
    "method": "assertMatcher",
    "args": [
      {
        "type": "Invocation",
        "value": {
          "target": {
            "type": "Class",
            "value": "androidx.test.espresso.Espresso"
          },
          "method": "onView",
          "args": [
            {
              "type": "Invocation",
              "value": {
                "target": {
                  "type": "Class",
                  "value": "com.wix.detox.espresso.DetoxMatcher"
                },
                "method": "matcherForText",
                "args": [
                  "Find your Gadget"
                ]
              }
            }
          ]
        }
      },
      {
        "type": "Invocation",
        "value": {
          "target": {
            "type": "Class",
            "value": "com.wix.detox.espresso.DetoxMatcher"
          },
          "method": "matcherForSufficientlyVisible",
          "args": [
            {
              "type": "Integer",
              "value": 75
            }
          ]
        }
      }
    ]
  }
12:25:57.143 detox[2219] [90mi[39m get
  data: {"messageId":2,"type":"testFailed","params":{"details":"'(view has effective visibility <VISIBLE> and view.getGlobalVisibleRect() covers at least <75> percent of the view's area)' doesn't match the selected view.\nExpected: (view has effective visibility <VISIBLE> and view.getGlobalVisibleRect() covers at least <75> percent of the view's area)\n     Got: was null\n"}}
12:25:57.143 detox[2219] [90mi[39m send
  data: {
    "messageId": 2,
    "type": "testFailed",
    "params": {
      "details": "'(view has effective visibility <VISIBLE> and view.getGlobalVisibleRect() covers at least <75> percent of the view's area)' doesn't match the selected view.\nExpected: (view has effective visibility <VISIBLE> and view.getGlobalVisibleRect() covers at least <75> percent of the view's area)\n     Got: was null\n"
    }
  }
12:25:57.144 detox[2220] [90mi[39m get message
  data: {"messageId":2,"type":"testFailed","params":{"details":"'(view has effective visibility <VISIBLE> and view.getGlobalVisibleRect() covers at least <75> percent of the view's area)' doesn't match the selected view.\nExpected: (view has effective visibility <VISIBLE> and view.getGlobalVisibleRect() covers at least <75> percent of the view's area)\n     Got: was null\n"}}
   
12:25:57.145 detox[2220] [90mE[39m expect element to be visible
  error: Test Failed: '(view has effective visibility <VISIBLE> and view.getGlobalVisibleRect() covers at least <75> percent of the view's area)' doesn't match the selected view.
  Expected: (view has effective visibility <VISIBLE> and view.getGlobalVisibleRect() covers at least <75> percent of the view's area)
       Got: was null
  
12:25:57.146 detox[2220] [90mB[39m onTestFnFailure
  args: ({"error":{"name":"DetoxRuntimeError"}})
12:25:57.147 detox[2220] [90mE[39m onTestFnFailure
12:25:57.147 detox[2220] [90mE[39m test_fn
  error: Test Failed: '(view has effective visibility <VISIBLE> and view.getGlobalVisibleRect() covers at least <75> percent of the view's area)' doesn't match the selected view.
  Expected: (view has effective visibility <VISIBLE> and view.getGlobalVisibleRect() covers at least <75> percent of the view's area)
       Got: was null
  
12:25:57.150 detox[2220] [90mB[39m onTestDone
  args: ({"title":"should have splash screen","fullName":"Example should have splash screen","status":"failed","invocations":1,"timedOut":false})
12:25:57.150 detox[2220] [90mi[39m stopping ADBLogcatRecording
12:25:57.150 detox[2220] [90mi[39m "/Users/priyaranganathan/Library/Android/sdk/platform-tools/adb" -s adb-b6b897f1-BhBLcd._adb-tls-connect._tcp. shell "date +\"%m-%d %T.000\""
12:25:57.273 detox[2220] [90mi[39m 05-19 12:25:55.000

12:25:57.273 detox[2220] [90mi[39m sending SIGINT to: /Users/priyaranganathan/Library/Android/sdk/platform-tools/adb -s adb-b6b897f1-BhBLcd._adb-tls-connect._tcp. shell logcat -T "05-19 12:25:52.000" --pid=17720 -f /sdcard/122526905_1.log
12:25:57.275 detox[2220] [90mi[39m /Users/priyaranganathan/Library/Android/sdk/platform-tools/adb -s adb-b6b897f1-BhBLcd._adb-tls-connect._tcp. shell "logcat -T \"05-19 12:25:52.000\" --pid=17720 -f /sdcard/122526905_1.log" terminated with SIGINT
12:25:57.281 detox[2220] [90mE[39m onTestDone
12:25:57.282 detox[2220] [90mE[39m should have splash screen
12:25:57.282 detox[2220] [90mi[39m Example: should have splash screen [FAIL]
12:25:57.287 detox[2220] [90mB[39m onRunDescribeFinish
  args: ({"name":"Example"})
12:25:57.287 detox[2220] [90mE[39m onRunDescribeFinish
12:25:57.287 detox[2220] [90mE[39m Example
12:25:57.287 detox[2220] [90mB[39m onRunDescribeFinish
  args: ({"name":"ROOT_DESCRIBE_BLOCK"})
12:25:57.287 detox[2220] [90mE[39m onRunDescribeFinish
12:25:57.288 detox[2220] [90mE[39m run the tests
12:25:57.334 detox[2220] [90mB[39m tear down environment
12:25:57.334 detox[2220] [90mB[39m onBeforeCleanup
  args: ()
12:25:57.336 detox[2220] [90mi[39m saving ADBLogcatRecording to: artifacts/android.att.debug.2023-05-19 06-55-26Z/✗ Example should have splash screen/device.log
12:25:57.336 detox[2220] [90mi[39m "/Users/priyaranganathan/Library/Android/sdk/platform-tools/adb" -s adb-b6b897f1-BhBLcd._adb-tls-connect._tcp. pull "/sdcard/122526905_1.log" "artifacts/android.att.debug.2023-05-19 06-55-26Z/✗ Example should have splash screen/device.log"
12:25:57.450 detox[2220] [90mi[39m /sdcard/122526905_1.log: 1 file pulled, 0 skipped. 0.5 MB/s (24839 bytes in 0.050s)

12:25:57.451 detox[2220] [90mi[39m "/Users/priyaranganathan/Library/Android/sdk/platform-tools/adb" -s adb-b6b897f1-BhBLcd._adb-tls-connect._tcp. shell "rm  \"/sdcard/122526905_1.log\""
12:25:57.584 detox[2220] [90mi[39m 
12:25:57.587 detox[2220] [90mi[39m saving ADBLogcatRecording to: artifacts/android.att.debug.2023-05-19 06-55-26Z/adb-b6b897f1-BhBLcd._adb-tls-connect._tcp. 2023-05-19 06-55-57Z.startup.log
12:25:57.587 detox[2220] [90mi[39m "/Users/priyaranganathan/Library/Android/sdk/platform-tools/adb" -s adb-b6b897f1-BhBLcd._adb-tls-connect._tcp. pull "/sdcard/122526905_0.log" "artifacts/android.att.debug.2023-05-19 06-55-26Z/adb-b6b897f1-BhBLcd._adb-tls-connect._tcp. 2023-05-19 06-55-57Z.startup.log"
12:25:57.692 detox[2220] [90mi[39m /sdcard/122526905_0.log: 1 file pulled, 0 skipped. 0.8 MB/s (36285 bytes in 0.041s)

12:25:57.692 detox[2220] [90mi[39m "/Users/priyaranganathan/Library/Android/sdk/platform-tools/adb" -s adb-b6b897f1-BhBLcd._adb-tls-connect._tcp. shell "rm  \"/sdcard/122526905_0.log\""
12:25:57.801 detox[2220] [90mi[39m 
12:25:57.804 detox[2220] [90mi[39m saving FileArtifact to: artifacts/android.att.debug.2023-05-19 06-55-26Z/detox_pid_2220.json.log { append: true }
12:25:57.804 detox[2220] [90mi[39m saving FileArtifact to: artifacts/android.att.debug.2023-05-19 06-55-26Z/detox_pid_2220.log { append: true }
12:25:57.804 detox[2220] [90mE[39m onBeforeCleanup
12:25:57.807 detox[2219] [90mi[39m get
  data: {"type":"cleanup","params":{"stopRunner":false},"messageId":-49642}
12:25:57.807 detox[2219] [90mi[39m send
  data: {
    "type": "cleanup",
    "params": {
      "stopRunner": false
    },
    "messageId": -49642
  }
12:25:57.807 detox[2220] [90mi[39m send message
  data: {"type":"cleanup","params":{"stopRunner":false},"messageId":-49642}
12:25:57.818 detox[2219] [90mi[39m get
  data: {"messageId":-49642,"type":"cleanupDone","params":{}}
12:25:57.818 detox[2219] [90mi[39m send
  data: {
    "messageId": -49642,
    "type": "cleanupDone",
    "params": {}
  }
12:25:57.818 detox[2220] [90mi[39m get message
  data: {"messageId":-49642,"type":"cleanupDone","params":{}}
   
12:25:57.823 detox[2219] [90mi[39m tester exited session ed2cc38e-fd7c-9aa5-b92b-8f99036ec3e1
12:25:57.823 detox[2219] [90mi[39m send
  data: {
    "type": "testerDisconnected",
    "messageId": -1
  }
12:25:57.824 detox[2219] [90mE[39m connection :50328<->:50329
12:25:57.825 detox[2220] [90mi[39m sending SIGINT to: /Users/priyaranganathan/Library/Android/sdk/platform-tools/adb -s adb-b6b897f1-BhBLcd._adb-tls-connect._tcp. shell am instrument -w -r -e detoxServer ws://localhost:50328 -e detoxSessionId ed2cc38e-fd7c-9aa5-b92b-8f99036ec3e1 -e debug false com.fakestore.test/androidx.test.runner.AndroidJUnitRunner
12:25:57.827 detox[2220] [90mi[39m /Users/priyaranganathan/Library/Android/sdk/platform-tools/adb -s adb-b6b897f1-BhBLcd._adb-tls-connect._tcp. shell am instrument -w -r -e detoxServer ws://localhost:50328 -e detoxSessionId ed2cc38e-fd7c-9aa5-b92b-8f99036ec3e1 -e debug false com.fakestore.test/androidx.test.runner.AndroidJUnitRunner terminated with SIGINT
12:25:57.828 detox[2220] [90mi[39m "/Users/priyaranganathan/Library/Android/sdk/platform-tools/adb" -s adb-b6b897f1-BhBLcd._adb-tls-connect._tcp. reverse --remove tcp:50328
12:25:57.838 detox[2220] [90mB[39m free
  args: ({"adbName":"adb-b6b897f1-BhBLcd._adb-tls-connect._tcp."}, {"shutdown":false})
12:25:57.841 detox[2220] [90mE[39m free
12:25:57.841 detox[2220] [90mE[39m tear down environment
12:25:57.841 detox[2220] [90mE[39m e2e/starter.test.js
12:25:57.850 detox[2220] [90mi[39m dispatching event to  primary-2219 /tmp/detox.primary-2219  :  reportTestResults , {
  testResults: [
    {
      success: false,
      testFilePath: '/Users/priyaranganathan/Documents/React_Native_Projects/FakeStore/e2e/starter.test.js',
      testExecError: undefined,
      isPermanentFailure: false
    }
  ]
}
12:25:57.851 detox[2219] [90mi[39m received event of :  reportTestResults {
  testResults: [
    {
      success: false,
      testFilePath: '/Users/priyaranganathan/Documents/React_Native_Projects/FakeStore/e2e/starter.test.js',
      isPermanentFailure: false
    }
  ]
}
12:25:57.852 detox[2219] [90mi[39m dispatching event to socket  :  reportTestResultsDone {
  testResults: [
    {
      success: false,
      testFilePath: '/Users/priyaranganathan/Documents/React_Native_Projects/FakeStore/e2e/starter.test.js',
      isPermanentFailure: false
    }
  ]
}
12:25:57.852 detox[2219] [90mi[39m broadcasting event to all known sockets listening to  /tmp/detox.primary-2219  :   sessionStateUpdate {
  testResults: [
    {
      success: false,
      testFilePath: '/Users/priyaranganathan/Documents/React_Native_Projects/FakeStore/e2e/starter.test.js',
      isPermanentFailure: false
    }
  ]
}
12:25:57.852 detox[2220] [90mi[39m ## received events ##
12:25:57.853 detox[2220] [90mi[39m detected event reportTestResultsDone {
  testResults: [
    {
      success: false,
      testFilePath: '/Users/priyaranganathan/Documents/React_Native_Projects/FakeStore/e2e/starter.test.js',
      isPermanentFailure: false
    }
  ]
}
12:25:57.856 detox[2219] [90mi[39m socket disconnected secondary-2220
12:25:57.856 detox[2220] [90mi[39m connection closed primary-2219 /tmp/detox.primary-2219 0 tries remaining of 0
12:25:57.856 detox[2220] [90mi[39m secondary-2220 exceeded connection rety amount of  or stopRetrying flag set.
12:25:57.873 detox[2220] [90mi[39m 
12:25:57.882 detox[2219] [90mE[39m Command failed with exit code = 1:
jest --config e2e/jest.config.js
12:25:57.883 detox[2219] [90mi[39m Detox server has been closed gracefully
12:25:57.884 detox[2219] [90mi[39m app exited session ed2cc38e-fd7c-9aa5-b92b-8f99036ec3e1
12:25:57.884 detox[2219] [90mE[39m connection :50328<->:50392
12:25:57.885 detox[2219] [90mE[39m node_modules/.bin/detox test --configuration android.att.debug --record-logs all
