13:05:39.365 detox[3217] [90mB[39m node_modules/.bin/detox test --configuration android.att.debug --record-logs all
  data: {
    "id": "da92b570-8431-0d64-ba8b-364badf1e52a",
    "detoxConfig": {
      "configurationName": "android.att.debug",
      "apps": {
        "default": {
          "type": "android.apk",
          "binaryPath": "android/app/build/outputs/apk/debug/app-debug.apk",
          "build": "cd android && ./gradlew assembleDebug assembleAndroidTest -DtestBuildType=debug",
          "reversePorts": [
            8081
          ]
        }
      },
      "artifacts": {
        "rootDir": "artifacts/android.att.debug.2023-05-19 07-35-39Z",
        "plugins": {
          "log": {
            "enabled": true,
            "keepOnlyFailedTestsArtifacts": false
          },
          "screenshot": {
            "enabled": true,
            "shouldTakeAutomaticSnapshots": false,
            "keepOnlyFailedTestsArtifacts": false
          },
          "video": {
            "enabled": false,
            "keepOnlyFailedTestsArtifacts": false
          },
          "instruments": {
            "enabled": false,
            "keepOnlyFailedTestsArtifacts": false
          },
          "uiHierarchy": {
            "enabled": false,
            "keepOnlyFailedTestsArtifacts": false
          }
        }
      },
      "behavior": {
        "init": {
          "keepLockFile": false,
          "reinstallApp": true,
          "exposeGlobals": true
        },
        "cleanup": {
          "shutdownDevice": false
        },
        "launchApp": "auto"
      },
      "cli": {
        "recordLogs": "all",
        "configuration": "android.att.debug",
        "start": true
      },
      "device": {
        "type": "android.attached",
        "device": {
          "adbName": ".*"
        }
      },
      "logger": {
        "level": "info",
        "overrideConsole": true,
        "options": {
          "showLoggerName": true,
          "showPid": true,
          "showLevel": false,
          "showMetadata": false,
          "basepath": "/Users/priyaranganathan/Documents/React_Native_Projects/FakeStore/node_modules/detox/src",
          "prefixers": {},
          "stringifiers": {}
        }
      },
      "testRunner": {
        "retries": 0,
        "forwardEnv": false,
        "bail": false,
        "jest": {
          "setupTimeout": 120000,
          "teardownTimeout": 30000,
          "retryAfterCircusRetries": false,
          "reportWorkerAssign": true
        },
        "args": {
          "$0": "jest",
          "_": [],
          "config": "e2e/jest.config.js",
          "--": []
        }
      },
      "session": {
        "autoStart": true,
        "debugSynchronization": 10000
      }
    },
    "detoxIPCServer": "primary-3217",
    "testResults": [],
    "testSessionIndex": 0,
    "workersCount": 0
  }
13:05:39.369 detox[3217] [90mi[39m Server path not specified, so defaulting to ipc.config.socketRoot + ipc.config.appspace + ipc.config.id /tmp/detox.primary-3217
13:05:39.371 detox[3217] [90mi[39m starting server on  /tmp/detox.primary-3217 
13:05:39.371 detox[3217] [90mi[39m starting TLS server false
13:05:39.371 detox[3217] [90mi[39m starting server as Unix || Windows Socket
13:05:39.376 detox[3217] [90mi[39m Detox server listening on localhost:51472...
13:05:39.381 detox[3217] [90mi[39m Serialized the session state at: /private/var/folders/nh/qgcf94bd36j7y52qsksxp38r0000gn/T/da92b570-8431-0d64-ba8b-364badf1e52a.detox.json
13:05:39.383 detox[3217] [90mB[39m jest --config e2e/jest.config.js
13:05:39.940 detox[3218] [90mi[39m Service path not specified, so defaulting to ipc.config.socketRoot + ipc.config.appspace + id 
13:05:39.941 detox[3218] [90mi[39m requested connection to  primary-3217 /tmp/detox.primary-3217
13:05:39.941 detox[3218] [90mi[39m Connecting client on Unix Socket : /tmp/detox.primary-3217
13:05:39.941 detox[3218] [90mi[39m retrying reset
13:05:39.942 detox[3217] [90mi[39m ## socket connection to server detected ##
13:05:39.943 detox[3218] [90mi[39m dispatching event to  primary-3217 /tmp/detox.primary-3217  :  registerContext , { id: 'secondary-3218' }
13:05:39.945 detox[3217] [90mi[39m received event of :  registerContext { id: 'secondary-3218' }
13:05:39.945 detox[3217] [90mi[39m dispatching event to socket  :  registerContextDone { testResults: [], testSessionIndex: 0 }
13:05:39.945 detox[3218] [90mi[39m ## received events ##
13:05:39.945 detox[3218] [90mi[39m detected event registerContextDone { testResults: [], testSessionIndex: 0 }
13:05:40.006 detox[3218] [90mB[39m e2e/starter.test.js
13:05:40.016 detox[3218] [90mB[39m set up environment
13:05:40.016 detox[3218] [90mi[39m dispatching event to  primary-3217 /tmp/detox.primary-3217  :  registerWorker , { workerId: 'w1' }
13:05:40.017 detox[3217] [90mi[39m received event of :  registerWorker { workerId: 'w1' }
13:05:40.017 detox[3217] [90mi[39m dispatching event to socket  :  registerWorkerDone { workersCount: 1 }
13:05:40.017 detox[3217] [90mi[39m broadcasting event to all known sockets listening to  /tmp/detox.primary-3217  :   sessionStateUpdate { workersCount: 1 }
13:05:40.017 detox[3218] [90mi[39m ## received events ##
13:05:40.017 detox[3218] [90mi[39m detected event registerWorkerDone { workersCount: 1 }
13:05:40.128 detox[3218] [90mi[39m ## received events ##
13:05:40.128 detox[3218] [90mi[39m detected event sessionStateUpdate { workersCount: 1 }
13:05:40.134 detox[3217] [90mB[39m connection :51472<->:51473
13:05:40.136 detox[3218] [90mi[39m opened web socket to: ws://localhost:51472
13:05:40.138 detox[3218] [90mi[39m send message
  data: {"type":"login","params":{"sessionId":"b68d03b6-79de-b9fa-53d8-a0e9567c759f","role":"tester"},"messageId":0}
13:05:40.139 detox[3217] [90mi[39m get
  data: {"type":"login","params":{"sessionId":"b68d03b6-79de-b9fa-53d8-a0e9567c759f","role":"tester"},"messageId":0}
13:05:40.139 detox[3217] [90mi[39m created session b68d03b6-79de-b9fa-53d8-a0e9567c759f
13:05:40.139 detox[3217] [90mi[39m send
  data: {
    "type": "loginSuccess",
    "params": {
      "testerConnected": true,
      "appConnected": false
    },
    "messageId": 0
  }
13:05:40.140 detox[3217] [90mi[39m tester joined session b68d03b6-79de-b9fa-53d8-a0e9567c759f
13:05:40.140 detox[3218] [90mi[39m get message
  data: {"type":"loginSuccess","params":{"testerConnected":true,"appConnected":false},"messageId":0}
   
13:05:40.169 detox[3218] [90mB[39m allocate
  args: ({"type":"android.attached","device":{"adbName":".*"}})
13:05:40.171 detox[3218] [90mi[39m "/Users/priyaranganathan/Library/Android/sdk/platform-tools/adb"  devices
13:05:40.201 detox[3218] [90mi[39m List of devices attached
b6b897f1	device


13:05:40.203 detox[3218] [90mi[39m Found a matching & free device b6b897f1
13:05:40.203 detox[3218] [90mE[39m allocate
13:05:40.204 detox[3218] [90mB[39m postAllocate
  args: ({"adbName":"b6b897f1"})
13:05:40.204 detox[3218] [90mi[39m "/Users/priyaranganathan/Library/Android/sdk/platform-tools/adb" -s b6b897f1 shell "getprop ro.build.version.sdk"
13:05:40.255 detox[3218] [90mi[39m 30

13:05:40.256 detox[3218] [90mi[39m "/Users/priyaranganathan/Library/Android/sdk/platform-tools/adb" -s b6b897f1 shell "dumpsys power | grep \"^[ ]*m[UW].*=\""
13:05:40.382 detox[3218] [90mi[39m   mWakefulness=Awake
  mWakefulnessChanging=false
  mWakeLockSummary=0x0
  mUserActivitySummary=0x1
  mWakeUpWhenPluggedOrUnpluggedConfig=true
  mWakeUpWhenPluggedOrUnpluggedInTheaterModeConfig=false
  mUserActivityTimeoutOverrideFromWindowManager=-1
  mUserInactiveOverrideFromWindowManager=false
  mUserId=0

13:05:40.382 detox[3218] [90mB[39m onBootDevice
  args: ({"deviceId":"b6b897f1","type":"device","coldBoot":false})
13:05:40.383 detox[3218] [90mE[39m onBootDevice
13:05:40.383 detox[3218] [90mE[39m postAllocate
13:05:40.407 detox[3218] [90mB[39m installUtilBinaries
  args: ()
13:05:40.407 detox[3218] [90mE[39m installUtilBinaries
13:05:40.407 detox[3218] [90mB[39m selectApp
  args: ("default")
13:05:40.409 detox[3218] [90mi[39m "/Users/priyaranganathan/Library/Android/sdk/build-tools/33.0.0/aapt" dump badging "/Users/priyaranganathan/Documents/React_Native_Projects/FakeStore/android/app/build/outputs/apk/debug/app-debug.apk"
13:05:40.437 detox[3218] [90mi[39m package: name='com.fakestore' versionCode='1' versionName='1.0' platformBuildVersionName='12' platformBuildVersionCode='31' compileSdkVersion='31' compileSdkVersionCodename='12'
sdkVersion:'21'
targetSdkVersion:'31'
uses-permission: name='android.permission.SYSTEM_ALERT_WINDOW'
uses-permission: name='android.permission.INTERNET'
uses-permission: name='android.permission.CAMERA'
uses-permission: name='android.permission.WRITE_EXTERNAL_STORAGE'
uses-permission: name='android.permission.ACCESS_FINE_LOCATION'
uses-permission: name='android.permission.ACCESS_COARSE_LOCATION'
uses-permission: name='android.permission.ACCESS_WIFI_STATE'
application-label:'FakeStore'
application-label-af:'FakeStore'
application-label-am:'FakeStore'
application-label-ar:'FakeStore'
application-label-as:'FakeStore'
application-label-az:'FakeStore'
application-label-be:'FakeStore'
application-label-bg:'FakeStore'
application-label-bn:'FakeStore'
application-label-bs:'FakeStore'
application-label-ca:'FakeStore'
application-label-cs:'FakeStore'
application-label-da:'FakeStore'
application-label-de:'FakeStore'
application-label-el:'FakeStore'
application-label-en-AU:'FakeStore'
application-label-en-CA:'FakeStore'
application-label-en-GB:'FakeStore'
application-label-en-IN:'FakeStore'
application-label-en-XC:'FakeStore'
application-label-es:'FakeStore'
application-label-es-US:'FakeStore'
application-label-et:'FakeStore'
application-label-eu:'FakeStore'
application-label-fa:'FakeStore'
application-label-fi:'FakeStore'
application-label-fr:'FakeStore'
application-label-fr-CA:'FakeStore'
application-label-gl:'FakeStore'
application-label-gu:'FakeStore'
application-label-hi:'FakeStore'
application-label-hr:'FakeStore'
application-label-hu:'FakeStore'
application-label-hy:'FakeStore'
application-label-in:'FakeStore'
application-label-is:'FakeStore'
application-label-it:'FakeStore'
application-label-iw:'FakeStore'
application-label-ja:'FakeStore'
application-label-ka:'FakeStore'
application-label-kk:'FakeStore'
application-label-km:'FakeStore'
application-label-kn:'FakeStore'
application-label-ko:'FakeStore'
application-label-ky:'FakeStore'
application-label-lo:'FakeStore'
application-label-lt:'FakeStore'
application-label-lv:'FakeStore'
application-label-mk:'FakeStore'
application-label-ml:'FakeStore'
application-label-mn:'FakeStore'
application-label-mr:'FakeStore'
application-label-ms:'FakeStore'
application-label-my:'FakeStore'
application-label-nb:'FakeStore'
application-label-ne:'FakeStore'
application-label-nl:'FakeStore'
application-label-or:'FakeStore'
application-label-pa:'FakeStore'
application-label-pl:'FakeStore'
application-label-pt:'FakeStore'
application-label-pt-BR:'FakeStore'
application-label-pt-PT:'FakeStore'
application-label-ro:'FakeStore'
application-label-ru:'FakeStore'
application-label-si:'FakeStore'
application-label-sk:'FakeStore'
application-label-sl:'FakeStore'
application-label-sq:'FakeStore'
application-label-sr:'FakeStore'
application-label-sr-Latn:'FakeStore'
application-label-sv:'FakeStore'
application-label-sw:'FakeStore'
application-label-ta:'FakeStore'
application-label-te:'FakeStore'
application-label-th:'FakeStore'
application-label-tl:'FakeStore'
application-label-tr:'FakeStore'
application-label-uk:'FakeStore'
application-label-ur:'FakeStore'
application-label-uz:'FakeStore'
application-label-vi:'FakeStore'
application-label-zh-CN:'FakeStore'
application-label-zh-HK:'FakeStore'
application-label-zh-TW:'FakeStore'
application-label-zu:'FakeStore'
application-icon-160:'res/mipmap-mdpi-v4/ic_launcher.png'
application-icon-240:'res/mipmap-hdpi-v4/ic_launcher.png'
application-icon-320:'res/mipmap-xhdpi-v4/ic_launcher.png'
application-icon-480:'res/mipmap-xxhdpi-v4/ic_launcher.png'
application-icon-640:'res/mipmap-xxxhdpi-v4/ic_launcher.png'
application-icon-65534:'res/mipmap-mdpi-v4/ic_launcher.png'
application: label='FakeStore' icon='res/mipmap-mdpi-v4/ic_launcher.png'
application-debuggable
launchable-activity: name='com.fakestore.MainActivity'  label='FakeStore' icon=''
uses-permission: name='android.permission.READ_EXTERNAL_STORAGE'
uses-implied-permission: name='android.permission.READ_EXTERNAL_STORAGE' reason='requested WRITE_EXTERNAL_STORAGE'
feature-group: label=''
  uses-feature: name='android.hardware.camera'
  uses-implied-feature: name='android.hardware.camera' reason='requested android.permission.CAMERA permission'
  uses-feature: name='android.hardware.faketouch'
  uses-implied-feature: name='android.hardware.faketouch' reason='default feature for all apps'
  uses-feature: name='android.hardware.location'
  uses-implied-feature: name='android.hardware.location' reason='requested android.permission.ACCESS_COARSE_LOCATION permission, and requested android.permission.ACCESS_FINE_LOCATION permission'
  uses-feature: name='android.hardware.wifi'
  uses-implied-feature: name='android.hardware.wifi' reason='requested android.permission.ACCESS_WIFI_STATE permission'
main
other-activities
supports-screens: 'small' 'normal' 'large' 'xlarge'
supports-any-density: 'true'
locales: '--_--' 'af' 'am' 'ar' 'as' 'az' 'be' 'bg' 'bn' 'bs' 'ca' 'cs' 'da' 'de' 'el' 'en-AU' 'en-CA' 'en-GB' 'en-IN' 'en-XC' 'es' 'es-US' 'et' 'eu' 'fa' 'fi' 'fr' 'fr-CA' 'gl' 'gu' 'hi' 'hr' 'hu' 'hy' 'in' 'is' 'it' 'iw' 'ja' 'ka' 'kk' 'km' 'kn' 'ko' 'ky' 'lo' 'lt' 'lv' 'mk' 'ml' 'mn' 'mr' 'ms' 'my' 'nb' 'ne' 'nl' 'or' 'pa' 'pl' 'pt' 'pt-BR' 'pt-PT' 'ro' 'ru' 'si' 'sk' 'sl' 'sq' 'sr' 'sr-Latn' 'sv' 'sw' 'ta' 'te' 'th' 'tl' 'tr' 'uk' 'ur' 'uz' 'vi' 'zh-CN' 'zh-HK' 'zh-TW' 'zu'
densities: '160' '240' '320' '480' '640' '65534'
native-code: 'arm64-v8a' 'armeabi-v7a' 'x86' 'x86_64'

13:05:40.438 detox[3218] [90mE[39m selectApp
13:05:40.438 detox[3218] [90mB[39m uninstallApp
  args: ()
13:05:40.438 detox[3218] [90mB[39m onBeforeUninstallApp
  args: ({"deviceId":"b6b897f1","bundleId":"com.fakestore"})
13:05:40.439 detox[3218] [90mE[39m onBeforeUninstallApp
13:05:40.439 detox[3218] [90mi[39m "/Users/priyaranganathan/Library/Android/sdk/platform-tools/adb" -s b6b897f1 shell "pm list packages com.fakestore"
13:05:40.509 detox[3218] [90mi[39m package:com.fakestore.test
package:com.fakestore

13:05:40.510 detox[3218] [90mi[39m "/Users/priyaranganathan/Library/Android/sdk/platform-tools/adb" -s b6b897f1 uninstall com.fakestore
13:05:41.142 detox[3218] [90mi[39m Success

13:05:41.143 detox[3218] [90mi[39m "/Users/priyaranganathan/Library/Android/sdk/platform-tools/adb" -s b6b897f1 shell "pm list packages com.fakestore.test"
13:05:41.240 detox[3218] [90mi[39m package:com.fakestore.test

13:05:41.240 detox[3218] [90mi[39m "/Users/priyaranganathan/Library/Android/sdk/platform-tools/adb" -s b6b897f1 uninstall com.fakestore.test
13:05:42.972 detox[3218] [90mi[39m Success

13:05:42.972 detox[3218] [90mE[39m uninstallApp
13:05:42.973 detox[3218] [90mB[39m selectApp
  args: ("default")
13:05:42.975 detox[3218] [90mB[39m terminateApp
  args: ()
13:05:42.976 detox[3218] [90mB[39m onBeforeTerminateApp
  args: ({"deviceId":"b6b897f1","bundleId":"com.fakestore"})
13:05:42.976 detox[3218] [90mE[39m onBeforeTerminateApp
13:05:42.977 detox[3218] [90mi[39m "/Users/priyaranganathan/Library/Android/sdk/platform-tools/adb" -s b6b897f1 shell "am force-stop com.fakestore"
13:05:43.112 detox[3218] [90mi[39m 
13:05:43.112 detox[3218] [90mB[39m onTerminateApp
  args: ({"deviceId":"b6b897f1","bundleId":"com.fakestore"})
13:05:43.112 detox[3218] [90mE[39m onTerminateApp
13:05:43.112 detox[3218] [90mE[39m terminateApp
13:05:43.112 detox[3218] [90mE[39m selectApp
13:05:43.113 detox[3218] [90mB[39m installApp
  args: ()
13:05:43.114 detox[3218] [90mi[39m "/Users/priyaranganathan/Library/Android/sdk/build-tools/33.0.0/aapt" dump xmlstrings "/Users/priyaranganathan/Documents/React_Native_Projects/FakeStore/android/app/build/outputs/apk/debug/app-debug.apk" AndroidManifest.xml
13:05:43.148 detox[3218] [90mi[39m String pool of 63 unique UTF-16 non-sorted strings, 63 entries and 0 styles using 3000 bytes:
String #0: theme
String #1: label
String #2: icon
String #3: name
String #4: debuggable
String #5: exported
String #6: authorities
String #7: grantUriPermissions
String #8: launchMode
String #9: configChanges
String #10: value
String #11: resource
String #12: minSdkVersion
String #13: versionCode
String #14: versionName
String #15: windowSoftInputMode
String #16: targetSdkVersion
String #17: allowBackup
String #18: usesCleartextTraffic
String #19: networkSecurityConfig
String #20: roundIcon
String #21: compileSdkVersion
String #22: compileSdkVersionCodename
String #23: appComponentFactory
String #24: 1.0
String #25: 12
String #26: action
String #27: activity
String #28: android
String #29: android.intent.action.MAIN
String #30: android.intent.category.LAUNCHER
String #31: android.permission.ACCESS_COARSE_LOCATION
String #32: android.permission.ACCESS_FINE_LOCATION
String #33: android.permission.ACCESS_WIFI_STATE
String #34: android.permission.CAMERA
String #35: android.permission.INTERNET
String #36: android.permission.SYSTEM_ALERT_WINDOW
String #37: android.permission.WRITE_EXTERNAL_STORAGE
String #38: android.support.FILE_PROVIDER_PATHS
String #39: androidx.core.app.CoreComponentFactory
String #40: androidx.emoji2.text.EmojiCompatInitializer
String #41: androidx.lifecycle.ProcessLifecycleInitializer
String #42: androidx.startup
String #43: androidx.startup.InitializationProvider
String #44: application
String #45: category
String #46: com.facebook.react.devsupport.DevSettingsActivity
String #47: com.fakestore
String #48: com.fakestore.MainActivity
String #49: com.fakestore.MainApplication
String #50: com.fakestore.androidx-startup
String #51: com.fakestore.imagepickerprovider
String #52: com.imagepicker.ImagePickerProvider
String #53: http://schemas.android.com/apk/res/android
String #54: intent-filter
String #55: manifest
String #56: meta-data
String #57: package
String #58: platformBuildVersionCode
String #59: platformBuildVersionName
String #60: provider
String #61: uses-permission
String #62: uses-sdk

13:05:43.149 detox[3218] [90mi[39m "/Users/priyaranganathan/Library/Android/sdk/build-tools/33.0.0/aapt" dump xmlstrings "/Users/priyaranganathan/Documents/React_Native_Projects/FakeStore/android/app/build/outputs/apk/androidTest/debug/app-debug-androidTest.apk" AndroidManifest.xml
13:05:43.174 detox[3218] [90mi[39m String pool of 42 unique UTF-16 non-sorted strings, 42 entries and 0 styles using 2060 bytes:
String #0: theme
String #1: label
String #2: name
String #3: debuggable
String #4: exported
String #5: priority
String #6: targetPackage
String #7: handleProfiling
String #8: functionalTest
String #9: minSdkVersion
String #10: targetSdkVersion
String #11: compileSdkVersion
String #12: compileSdkVersionCodename
String #13: 12
String #14: Tests for com.fakestore
String #15: activity
String #16: android
String #17: android.intent.category.LAUNCHER
String #18: android.permission.REORDER_TASKS
String #19: android.test.runner
String #20: androidx.test.core.app.InstrumentationActivityInvoker$BootstrapActivity
String #21: androidx.test.core.app.InstrumentationActivityInvoker$EmptyActivity
String #22: androidx.test.core.app.InstrumentationActivityInvoker$EmptyFloatingActivity
String #23: androidx.test.orchestrator
String #24: androidx.test.runner.AndroidJUnitRunner
String #25: androidx.test.services
String #26: application
String #27: category
String #28: com.fakestore
String #29: com.fakestore.test
String #30: com.google.android.apps.common.testing.services
String #31: http://schemas.android.com/apk/res/android
String #32: instrumentation
String #33: intent-filter
String #34: manifest
String #35: package
String #36: platformBuildVersionCode
String #37: platformBuildVersionName
String #38: queries
String #39: uses-library
String #40: uses-permission
String #41: uses-sdk

13:05:43.181 detox[3218] [90mi[39m /Users/priyaranganathan/Library/Android/sdk/platform-tools/adb -s b6b897f1 install -r -g -t /Users/priyaranganathan/Documents/React_Native_Projects/FakeStore/android/app/build/outputs/apk/debug/app-debug.apk
13:05:47.475 detox[3218] [90mi[39m Performing Streamed Install
Success

13:05:47.476 detox[3218] [90mi[39m /Users/priyaranganathan/Library/Android/sdk/platform-tools/adb -s b6b897f1 install -r -g -t /Users/priyaranganathan/Documents/React_Native_Projects/FakeStore/android/app/build/outputs/apk/debug/app-debug.apk exited with code #0
13:05:47.490 detox[3218] [90mi[39m /Users/priyaranganathan/Library/Android/sdk/platform-tools/adb -s b6b897f1 install -r -g -t /Users/priyaranganathan/Documents/React_Native_Projects/FakeStore/android/app/build/outputs/apk/androidTest/debug/app-debug-androidTest.apk
13:05:50.724 detox[3218] [90mi[39m Performing Streamed Install
Success

13:05:50.730 detox[3218] [90mi[39m /Users/priyaranganathan/Library/Android/sdk/platform-tools/adb -s b6b897f1 install -r -g -t /Users/priyaranganathan/Documents/React_Native_Projects/FakeStore/android/app/build/outputs/apk/androidTest/debug/app-debug-androidTest.apk exited with code #0
13:05:50.731 detox[3218] [90mB[39m reverseTcpPort
  args: (8081)
13:05:50.732 detox[3218] [90mi[39m "/Users/priyaranganathan/Library/Android/sdk/platform-tools/adb" -s b6b897f1 reverse tcp:8081 tcp:8081
13:05:50.790 detox[3218] [90mi[39m 
13:05:50.790 detox[3218] [90mE[39m reverseTcpPort
13:05:50.790 detox[3218] [90mE[39m installApp
13:05:50.791 detox[3218] [90mB[39m selectApp
  args: ("default")
13:05:50.791 detox[3218] [90mB[39m terminateApp
  args: ()
13:05:50.791 detox[3218] [90mB[39m onBeforeTerminateApp
  args: ({"deviceId":"b6b897f1","bundleId":"com.fakestore"})
13:05:50.791 detox[3218] [90mE[39m onBeforeTerminateApp
13:05:50.791 detox[3218] [90mi[39m "/Users/priyaranganathan/Library/Android/sdk/platform-tools/adb" -s b6b897f1 shell "am force-stop com.fakestore"
13:05:50.952 detox[3218] [90mi[39m 
13:05:50.952 detox[3218] [90mB[39m onTerminateApp
  args: ({"deviceId":"b6b897f1","bundleId":"com.fakestore"})
13:05:50.953 detox[3218] [90mE[39m onTerminateApp
13:05:50.953 detox[3218] [90mE[39m terminateApp
13:05:50.953 detox[3218] [90mE[39m selectApp
13:05:50.954 detox[3218] [90mE[39m set up environment
13:05:51.266 detox[3218] [90mi[39m starter.test.js is assigned to AttachedDevice:b6b897f1
13:05:51.267 detox[3218] [90mB[39m run the tests
13:05:51.267 detox[3218] [90mB[39m onRunDescribeStart
  args: ({"name":"ROOT_DESCRIBE_BLOCK"})
13:05:51.267 detox[3218] [90mE[39m onRunDescribeStart
13:05:51.268 detox[3218] [90mB[39m Example
13:05:51.268 detox[3218] [90mB[39m onRunDescribeStart
  args: ({"name":"Example"})
13:05:51.268 detox[3218] [90mE[39m onRunDescribeStart
13:05:51.269 detox[3218] [90mB[39m beforeAll
13:05:51.273 detox[3218] [90mB[39m launchApp
  args: ()
13:05:51.273 detox[3218] [90mB[39m terminateApp
  args: ("com.fakestore")
13:05:51.273 detox[3218] [90mB[39m onBeforeTerminateApp
  args: ({"deviceId":"b6b897f1","bundleId":"com.fakestore"})
13:05:51.273 detox[3218] [90mE[39m onBeforeTerminateApp
13:05:51.273 detox[3218] [90mi[39m "/Users/priyaranganathan/Library/Android/sdk/platform-tools/adb" -s b6b897f1 shell "am force-stop com.fakestore"
13:05:51.393 detox[3218] [90mi[39m 
13:05:51.393 detox[3218] [90mB[39m onTerminateApp
  args: ({"deviceId":"b6b897f1","bundleId":"com.fakestore"})
13:05:51.394 detox[3218] [90mE[39m onTerminateApp
13:05:51.394 detox[3218] [90mE[39m terminateApp
13:05:51.395 detox[3218] [90mB[39m onBeforeLaunchApp
  args: ({"deviceId":"b6b897f1","bundleId":"com.fakestore","launchArgs":{"detoxServer":"ws://localhost:51472","detoxSessionId":"b68d03b6-79de-b9fa-53d8-a0e9567c759f"}})
13:05:51.395 detox[3218] [90mi[39m "/Users/priyaranganathan/Library/Android/sdk/platform-tools/adb" -s b6b897f1 shell "date +\"%m-%d %T.000\""
13:05:51.475 detox[3218] [90mi[39m 05-19 13:05:49.000

13:05:51.475 detox[3218] [90mE[39m onBeforeLaunchApp
13:05:51.476 detox[3218] [90mi[39m "/Users/priyaranganathan/Library/Android/sdk/platform-tools/adb" -s b6b897f1 reverse tcp:51472 tcp:51472
13:05:51.510 detox[3218] [90mi[39m 51472

13:05:51.510 detox[3218] [90mi[39m "/Users/priyaranganathan/Library/Android/sdk/platform-tools/adb" -s b6b897f1 shell "pm list instrumentation"
13:05:51.640 detox[3218] [90mi[39m instrumentation:com.fakestore.test/androidx.test.runner.AndroidJUnitRunner (target=com.fakestore)

13:05:51.652 detox[3218] [90mi[39m /Users/priyaranganathan/Library/Android/sdk/platform-tools/adb -s b6b897f1 shell am instrument -w -r -e detoxServer ws://localhost:51472 -e detoxSessionId b68d03b6-79de-b9fa-53d8-a0e9567c759f -e debug false com.fakestore.test/androidx.test.runner.AndroidJUnitRunner
13:05:52.157 detox[3218] [90mi[39m "/Users/priyaranganathan/Library/Android/sdk/platform-tools/adb" -s b6b897f1 shell "ps | grep \"com\.fakestore$\""
13:05:52.411 detox[3218] [90mi[39m u0_a1033       2341    951 5847892 130204 0                   0 R com.fakestore

13:05:52.411 detox[3218] [90mB[39m onLaunchApp
  args: ({"deviceId":"b6b897f1","bundleId":"com.fakestore","launchArgs":{"detoxServer":"ws://localhost:51472","detoxSessionId":"b68d03b6-79de-b9fa-53d8-a0e9567c759f"},"pid":2341})
13:05:52.413 detox[3218] [90mi[39m starting ADBLogcatRecording
13:05:52.427 detox[3218] [90mi[39m /Users/priyaranganathan/Library/Android/sdk/platform-tools/adb -s b6b897f1 shell "logcat -T \"05-19 13:05:49.000\" --pid=2341 -f /sdcard/13540164_0.log"
13:05:52.428 detox[3218] [90mE[39m onLaunchApp
13:05:52.731 detox[3218] [90mi[39m "/Users/priyaranganathan/Library/Android/sdk/platform-tools/adb" -s b6b897f1 shell du /sdcard/13540164_0.log
13:05:52.824 detox[3218] [90mi[39m 12	/sdcard/13540164_0.log

13:05:53.536 detox[3218] [90mi[39m INSTRUMENTATION_STATUS: class=com.fakestore.DetoxTest
INSTRUMENTATION_STATUS: current=1
INSTRUMENTATION_STATUS: id=AndroidJUnitRunner
INSTRUMENTATION_STATUS: numtests=1
INSTRUMENTATION_STATUS: stream=
com.fakestore.DetoxTest:
INSTRUMENTATION_STATUS: test=runDetoxTests
INSTRUMENTATION_STATUS_CODE: 1

13:05:54.164 detox[3217] [90mB[39m connection :51472<->:51538
13:05:54.171 detox[3217] [90mi[39m get
  data: {"messageId":0,"type":"login","params":{"role":"app","sessionId":"b68d03b6-79de-b9fa-53d8-a0e9567c759f"}}
13:05:54.172 detox[3217] [90mi[39m send
  data: {
    "messageId": 0,
    "type": "loginSuccess",
    "params": {
      "testerConnected": true,
      "appConnected": true
    }
  }
13:05:54.173 detox[3217] [90mi[39m app joined session b68d03b6-79de-b9fa-53d8-a0e9567c759f
13:05:54.173 detox[3217] [90mi[39m send
  data: {
    "type": "appConnected"
  }
13:05:54.176 detox[3218] [90mi[39m get message
  data: {"type":"appConnected"}
   
13:05:54.182 detox[3218] [90mi[39m send message
  data: {"type":"isReady","params":{},"messageId":-1000}
13:05:54.184 detox[3217] [90mi[39m get
  data: {"type":"isReady","params":{},"messageId":-1000}
13:05:54.185 detox[3217] [90mi[39m send
  data: {
    "type": "isReady",
    "params": {},
    "messageId": -1000
  }
13:05:55.382 detox[3217] [90mi[39m get
  data: {"messageId":-1000,"type":"ready","params":{}}
13:05:55.383 detox[3217] [90mi[39m send
  data: {
    "messageId": -1000,
    "type": "ready",
    "params": {}
  }
13:05:55.384 detox[3218] [90mi[39m get message
  data: {"messageId":-1000,"type":"ready","params":{}}
   
13:05:55.387 detox[3218] [90mB[39m onAppReady
  args: ({"deviceId":"b6b897f1","bundleId":"com.fakestore","pid":2341})
13:05:55.387 detox[3218] [90mE[39m onAppReady
13:05:55.387 detox[3218] [90mE[39m launchApp
13:05:55.388 detox[3218] [90mE[39m beforeAll
13:05:55.390 detox[3218] [90mB[39m should have splash screen
13:05:55.391 detox[3218] [90mi[39m Example: should have splash screen
13:05:55.394 detox[3218] [90mB[39m onTestStart
  args: ({"title":"should have splash screen","fullName":"Example should have splash screen","status":"running","invocations":1})
13:05:55.395 detox[3218] [90mi[39m stopping ADBLogcatRecording
13:05:55.395 detox[3218] [90mi[39m "/Users/priyaranganathan/Library/Android/sdk/platform-tools/adb" -s b6b897f1 shell "date +\"%m-%d %T.000\""
13:05:55.418 detox[3217] [90mi[39m get
  data: {"messageId":-1000,"type":"ready","params":{}}
13:05:55.418 detox[3217] [90mi[39m send
  data: {
    "messageId": -1000,
    "type": "ready",
    "params": {}
  }
13:05:55.419 detox[3218] [90mi[39m get message
  data: {"messageId":-1000,"type":"ready","params":{}}
   
13:05:55.481 detox[3218] [90mi[39m 05-19 13:05:53.000

13:05:55.483 detox[3218] [90mi[39m sending SIGINT to: /Users/priyaranganathan/Library/Android/sdk/platform-tools/adb -s b6b897f1 shell logcat -T "05-19 13:05:49.000" --pid=2341 -f /sdcard/13540164_0.log
13:05:55.485 detox[3218] [90mi[39m /Users/priyaranganathan/Library/Android/sdk/platform-tools/adb -s b6b897f1 shell "logcat -T \"05-19 13:05:49.000\" --pid=2341 -f /sdcard/13540164_0.log" terminated with SIGINT
13:05:55.486 detox[3218] [90mi[39m starting ADBLogcatRecording
13:05:55.495 detox[3218] [90mi[39m /Users/priyaranganathan/Library/Android/sdk/platform-tools/adb -s b6b897f1 shell "logcat -T \"05-19 13:05:53.000\" --pid=2341 -f /sdcard/13540164_1.log"
13:05:55.495 detox[3218] [90mE[39m onTestStart
13:05:55.495 detox[3218] [90mB[39m beforeEach
13:05:55.495 detox[3218] [90mE[39m beforeEach
13:05:55.496 detox[3218] [90mB[39m test_fn
13:05:55.498 detox[3218] [90mi[39m send message
  data: {"type":"invoke","params":{"target":{"type":"Class","value":"com.wix.detox.espresso.DetoxAssertion"},"method":"waitForAssertMatcher","args":[{"type":"Invocation","value":{"target":{"type":"Class","value":"androidx.test.espresso.Espresso"},"method":"onView","args":[{"type":"Invocation","value":{"target":{"type":"Class","value":"com.wix.detox.espresso.DetoxMatcher"},"method":"matcherForText","args":["Fake Store"]}}]}},{"type":"Invocation","value":{"target":{"type":"Class","value":"com.wix.detox.espresso.DetoxMatcher"},"method":"matcherForSufficientlyVisible","args":[{"type":"Integer","value":75}]}},{"type":"Double","value":50}]},"messageId":1}
13:05:55.499 detox[3217] [90mi[39m get
  data: {"type":"invoke","params":{"target":{"type":"Class","value":"com.wix.detox.espresso.DetoxAssertion"},"method":"waitForAssertMatcher","args":[{"type":"Invocation","value":{"target":{"type":"Class","value":"androidx.test.espresso.Espresso"},"method":"onView","args":[{"type":"Invocation","value":{"target":{"type":"Class","value":"com.wix.detox.espresso.DetoxMatcher"},"method":"matcherForText","args":["Fake Store"]}}]}},{"type":"Invocation","value":{"target":{"type":"Class","value":"com.wix.detox.espresso.DetoxMatcher"},"method":"matcherForSufficientlyVisible","args":[{"type":"Integer","value":75}]}},{"type":"Double","value":50}]},"messageId":1}
13:05:55.499 detox[3217] [90mi[39m send
  data: {
    "type": "invoke",
    "params": {
      "target": {
        "type": "Class",
        "value": "com.wix.detox.espresso.DetoxAssertion"
      },
      "method": "waitForAssertMatcher",
      "args": [
        {
          "type": "Invocation",
          "value": {
            "target": {
              "type": "Class",
              "value": "androidx.test.espresso.Espresso"
            },
            "method": "onView",
            "args": [
              {
                "type": "Invocation",
                "value": {
                  "target": {
                    "type": "Class",
                    "value": "com.wix.detox.espresso.DetoxMatcher"
                  },
                  "method": "matcherForText",
                  "args": [
                    "Fake Store"
                  ]
                }
              }
            ]
          }
        },
        {
          "type": "Invocation",
          "value": {
            "target": {
              "type": "Class",
              "value": "com.wix.detox.espresso.DetoxMatcher"
            },
            "method": "matcherForSufficientlyVisible",
            "args": [
              {
                "type": "Integer",
                "value": 75
              }
            ]
          }
        },
        {
          "type": "Double",
          "value": 50
        }
      ]
    },
    "messageId": 1
  }
13:05:55.500 detox[3218] [90mB[39m undefined with timeout (50000 ms)
  data: {
    "target": {
      "type": "Class",
      "value": "com.wix.detox.espresso.DetoxAssertion"
    },
    "method": "waitForAssertMatcher",
    "args": [
      {
        "type": "Invocation",
        "value": {
          "target": {
            "type": "Class",
            "value": "androidx.test.espresso.Espresso"
          },
          "method": "onView",
          "args": [
            {
              "type": "Invocation",
              "value": {
                "target": {
                  "type": "Class",
                  "value": "com.wix.detox.espresso.DetoxMatcher"
                },
                "method": "matcherForText",
                "args": [
                  "Fake Store"
                ]
              }
            }
          ]
        }
      },
      {
        "type": "Invocation",
        "value": {
          "target": {
            "type": "Class",
            "value": "com.wix.detox.espresso.DetoxMatcher"
          },
          "method": "matcherForSufficientlyVisible",
          "args": [
            {
              "type": "Integer",
              "value": 75
            }
          ]
        }
      },
      {
        "type": "Double",
        "value": 50
      }
    ]
  }
13:05:55.750 detox[3217] [90mi[39m get
  data: {"messageId":1,"type":"invokeResult","params":{"result":null}}
13:05:55.750 detox[3217] [90mi[39m send
  data: {
    "messageId": 1,
    "type": "invokeResult",
    "params": {
      "result": null
    }
  }
13:05:55.752 detox[3218] [90mi[39m get message
  data: {"messageId":1,"type":"invokeResult","params":{"result":null}}
   
13:05:55.754 detox[3218] [90mE[39m undefined with timeout (50000 ms)
13:05:55.759 detox[3218] [90mi[39m send message
  data: {"type":"invoke","params":{"target":{"type":"Class","value":"com.wix.detox.espresso.DetoxAssertion"},"method":"assertMatcher","args":[{"type":"Invocation","value":{"target":{"type":"Class","value":"androidx.test.espresso.Espresso"},"method":"onView","args":[{"type":"Invocation","value":{"target":{"type":"Class","value":"com.wix.detox.espresso.DetoxMatcher"},"method":"matcherForText","args":["Find your Gadget"]}}]}},{"type":"Invocation","value":{"target":{"type":"Class","value":"com.wix.detox.espresso.DetoxMatcher"},"method":"matcherForSufficientlyVisible","args":[{"type":"Integer","value":75}]}}]},"messageId":2}
13:05:55.760 detox[3217] [90mi[39m get
  data: {"type":"invoke","params":{"target":{"type":"Class","value":"com.wix.detox.espresso.DetoxAssertion"},"method":"assertMatcher","args":[{"type":"Invocation","value":{"target":{"type":"Class","value":"androidx.test.espresso.Espresso"},"method":"onView","args":[{"type":"Invocation","value":{"target":{"type":"Class","value":"com.wix.detox.espresso.DetoxMatcher"},"method":"matcherForText","args":["Find your Gadget"]}}]}},{"type":"Invocation","value":{"target":{"type":"Class","value":"com.wix.detox.espresso.DetoxMatcher"},"method":"matcherForSufficientlyVisible","args":[{"type":"Integer","value":75}]}}]},"messageId":2}
13:05:55.760 detox[3217] [90mi[39m send
  data: {
    "type": "invoke",
    "params": {
      "target": {
        "type": "Class",
        "value": "com.wix.detox.espresso.DetoxAssertion"
      },
      "method": "assertMatcher",
      "args": [
        {
          "type": "Invocation",
          "value": {
            "target": {
              "type": "Class",
              "value": "androidx.test.espresso.Espresso"
            },
            "method": "onView",
            "args": [
              {
                "type": "Invocation",
                "value": {
                  "target": {
                    "type": "Class",
                    "value": "com.wix.detox.espresso.DetoxMatcher"
                  },
                  "method": "matcherForText",
                  "args": [
                    "Find your Gadget"
                  ]
                }
              }
            ]
          }
        },
        {
          "type": "Invocation",
          "value": {
            "target": {
              "type": "Class",
              "value": "com.wix.detox.espresso.DetoxMatcher"
            },
            "method": "matcherForSufficientlyVisible",
            "args": [
              {
                "type": "Integer",
                "value": 75
              }
            ]
          }
        }
      ]
    },
    "messageId": 2
  }
13:05:55.760 detox[3218] [90mB[39m expect element to be visible
  data: {
    "target": {
      "type": "Class",
      "value": "com.wix.detox.espresso.DetoxAssertion"
    },
    "method": "assertMatcher",
    "args": [
      {
        "type": "Invocation",
        "value": {
          "target": {
            "type": "Class",
            "value": "androidx.test.espresso.Espresso"
          },
          "method": "onView",
          "args": [
            {
              "type": "Invocation",
              "value": {
                "target": {
                  "type": "Class",
                  "value": "com.wix.detox.espresso.DetoxMatcher"
                },
                "method": "matcherForText",
                "args": [
                  "Find your Gadget"
                ]
              }
            }
          ]
        }
      },
      {
        "type": "Invocation",
        "value": {
          "target": {
            "type": "Class",
            "value": "com.wix.detox.espresso.DetoxMatcher"
          },
          "method": "matcherForSufficientlyVisible",
          "args": [
            {
              "type": "Integer",
              "value": 75
            }
          ]
        }
      }
    ]
  }
13:05:55.785 detox[3217] [90mi[39m get
  data: {"messageId":2,"type":"testFailed","params":{"details":"'(view has effective visibility <VISIBLE> and view.getGlobalVisibleRect() covers at least <75> percent of the view's area)' doesn't match the selected view.\nExpected: (view has effective visibility <VISIBLE> and view.getGlobalVisibleRect() covers at least <75> percent of the view's area)\n     Got: was null\n"}}
13:05:55.785 detox[3217] [90mi[39m send
  data: {
    "messageId": 2,
    "type": "testFailed",
    "params": {
      "details": "'(view has effective visibility <VISIBLE> and view.getGlobalVisibleRect() covers at least <75> percent of the view's area)' doesn't match the selected view.\nExpected: (view has effective visibility <VISIBLE> and view.getGlobalVisibleRect() covers at least <75> percent of the view's area)\n     Got: was null\n"
    }
  }
13:05:55.786 detox[3218] [90mi[39m get message
  data: {"messageId":2,"type":"testFailed","params":{"details":"'(view has effective visibility <VISIBLE> and view.getGlobalVisibleRect() covers at least <75> percent of the view's area)' doesn't match the selected view.\nExpected: (view has effective visibility <VISIBLE> and view.getGlobalVisibleRect() covers at least <75> percent of the view's area)\n     Got: was null\n"}}
   
13:05:55.789 detox[3218] [90mE[39m expect element to be visible
  error: Test Failed: '(view has effective visibility <VISIBLE> and view.getGlobalVisibleRect() covers at least <75> percent of the view's area)' doesn't match the selected view.
  Expected: (view has effective visibility <VISIBLE> and view.getGlobalVisibleRect() covers at least <75> percent of the view's area)
       Got: was null
  
13:05:55.790 detox[3218] [90mB[39m onTestFnFailure
  args: ({"error":{"name":"DetoxRuntimeError"}})
13:05:55.790 detox[3218] [90mE[39m onTestFnFailure
13:05:55.791 detox[3218] [90mE[39m test_fn
  error: Test Failed: '(view has effective visibility <VISIBLE> and view.getGlobalVisibleRect() covers at least <75> percent of the view's area)' doesn't match the selected view.
  Expected: (view has effective visibility <VISIBLE> and view.getGlobalVisibleRect() covers at least <75> percent of the view's area)
       Got: was null
  
13:05:55.793 detox[3218] [90mB[39m onTestDone
  args: ({"title":"should have splash screen","fullName":"Example should have splash screen","status":"failed","invocations":1,"timedOut":false})
13:05:55.794 detox[3218] [90mi[39m stopping ADBLogcatRecording
13:05:55.794 detox[3218] [90mi[39m "/Users/priyaranganathan/Library/Android/sdk/platform-tools/adb" -s b6b897f1 shell du /sdcard/13540164_1.log
13:05:55.867 detox[3218] [90mi[39m 16	/sdcard/13540164_1.log

13:05:55.867 detox[3218] [90mi[39m "/Users/priyaranganathan/Library/Android/sdk/platform-tools/adb" -s b6b897f1 shell "date +\"%m-%d %T.000\""
13:05:55.922 detox[3218] [90mi[39m 05-19 13:05:54.000

13:05:55.924 detox[3218] [90mi[39m sending SIGINT to: /Users/priyaranganathan/Library/Android/sdk/platform-tools/adb -s b6b897f1 shell logcat -T "05-19 13:05:53.000" --pid=2341 -f /sdcard/13540164_1.log
13:05:55.925 detox[3218] [90mi[39m /Users/priyaranganathan/Library/Android/sdk/platform-tools/adb -s b6b897f1 shell "logcat -T \"05-19 13:05:53.000\" --pid=2341 -f /sdcard/13540164_1.log" terminated with SIGINT
13:05:55.929 detox[3218] [90mE[39m onTestDone
13:05:55.929 detox[3218] [90mE[39m should have splash screen
13:05:55.929 detox[3218] [90mi[39m Example: should have splash screen [FAIL]
13:05:55.932 detox[3218] [90mB[39m onRunDescribeFinish
  args: ({"name":"Example"})
13:05:55.933 detox[3218] [90mE[39m onRunDescribeFinish
13:05:55.933 detox[3218] [90mE[39m Example
13:05:55.933 detox[3218] [90mB[39m onRunDescribeFinish
  args: ({"name":"ROOT_DESCRIBE_BLOCK"})
13:05:55.933 detox[3218] [90mE[39m onRunDescribeFinish
13:05:55.933 detox[3218] [90mE[39m run the tests
13:05:55.985 detox[3218] [90mB[39m tear down environment
13:05:55.985 detox[3218] [90mB[39m onBeforeCleanup
  args: ()
13:05:55.986 detox[3218] [90mi[39m saving ADBLogcatRecording to: artifacts/android.att.debug.2023-05-19 07-35-39Z/✗ Example should have splash screen/device.log
13:05:55.986 detox[3218] [90mi[39m "/Users/priyaranganathan/Library/Android/sdk/platform-tools/adb" -s b6b897f1 pull "/sdcard/13540164_1.log" "artifacts/android.att.debug.2023-05-19 07-35-39Z/✗ Example should have splash screen/device.log"
13:05:56.021 detox[3218] [90mi[39m /sdcard/13540164_1.log: 1 file pulled, 0 skipped. 3.8 MB/s (12849 bytes in 0.003s)

13:05:56.022 detox[3218] [90mi[39m "/Users/priyaranganathan/Library/Android/sdk/platform-tools/adb" -s b6b897f1 shell "rm  \"/sdcard/13540164_1.log\""
13:05:56.155 detox[3218] [90mi[39m 
13:05:56.158 detox[3218] [90mi[39m saving ADBLogcatRecording to: artifacts/android.att.debug.2023-05-19 07-35-39Z/b6b897f1 2023-05-19 07-35-56Z.startup.log
13:05:56.158 detox[3218] [90mi[39m "/Users/priyaranganathan/Library/Android/sdk/platform-tools/adb" -s b6b897f1 pull "/sdcard/13540164_0.log" "artifacts/android.att.debug.2023-05-19 07-35-39Z/b6b897f1 2023-05-19 07-35-56Z.startup.log"
13:05:56.206 detox[3218] [90mi[39m /sdcard/13540164_0.log: 1 file pulled, 0 skipped. 8.6 MB/s (36785 bytes in 0.004s)

13:05:56.207 detox[3218] [90mi[39m "/Users/priyaranganathan/Library/Android/sdk/platform-tools/adb" -s b6b897f1 shell "rm  \"/sdcard/13540164_0.log\""
13:05:56.280 detox[3218] [90mi[39m 
13:05:56.282 detox[3218] [90mi[39m saving FileArtifact to: artifacts/android.att.debug.2023-05-19 07-35-39Z/detox_pid_3218.json.log { append: true }
13:05:56.282 detox[3218] [90mi[39m saving FileArtifact to: artifacts/android.att.debug.2023-05-19 07-35-39Z/detox_pid_3218.log { append: true }
13:05:56.282 detox[3218] [90mE[39m onBeforeCleanup
13:05:56.284 detox[3217] [90mi[39m get
  data: {"type":"cleanup","params":{"stopRunner":false},"messageId":-49642}
13:05:56.284 detox[3218] [90mi[39m send message
  data: {"type":"cleanup","params":{"stopRunner":false},"messageId":-49642}
13:05:56.285 detox[3217] [90mi[39m send
  data: {
    "type": "cleanup",
    "params": {
      "stopRunner": false
    },
    "messageId": -49642
  }
13:05:56.288 detox[3217] [90mi[39m get
  data: {"messageId":-49642,"type":"cleanupDone","params":{}}
13:05:56.288 detox[3217] [90mi[39m send
  data: {
    "messageId": -49642,
    "type": "cleanupDone",
    "params": {}
  }
13:05:56.288 detox[3218] [90mi[39m get message
  data: {"messageId":-49642,"type":"cleanupDone","params":{}}
   
13:05:56.292 detox[3217] [90mi[39m tester exited session b68d03b6-79de-b9fa-53d8-a0e9567c759f
13:05:56.292 detox[3217] [90mi[39m send
  data: {
    "type": "testerDisconnected",
    "messageId": -1
  }
13:05:56.292 detox[3217] [90mE[39m connection :51472<->:51473
13:05:56.294 detox[3218] [90mi[39m sending SIGINT to: /Users/priyaranganathan/Library/Android/sdk/platform-tools/adb -s b6b897f1 shell am instrument -w -r -e detoxServer ws://localhost:51472 -e detoxSessionId b68d03b6-79de-b9fa-53d8-a0e9567c759f -e debug false com.fakestore.test/androidx.test.runner.AndroidJUnitRunner
13:05:56.296 detox[3218] [90mi[39m /Users/priyaranganathan/Library/Android/sdk/platform-tools/adb -s b6b897f1 shell am instrument -w -r -e detoxServer ws://localhost:51472 -e detoxSessionId b68d03b6-79de-b9fa-53d8-a0e9567c759f -e debug false com.fakestore.test/androidx.test.runner.AndroidJUnitRunner terminated with SIGINT
13:05:56.296 detox[3218] [90mi[39m "/Users/priyaranganathan/Library/Android/sdk/platform-tools/adb" -s b6b897f1 reverse --remove tcp:51472
13:05:56.305 detox[3218] [90mB[39m free
  args: ({"adbName":"b6b897f1"}, {"shutdown":false})
13:05:56.307 detox[3218] [90mE[39m free
13:05:56.308 detox[3218] [90mE[39m tear down environment
13:05:56.308 detox[3218] [90mE[39m e2e/starter.test.js
13:05:56.314 detox[3218] [90mi[39m dispatching event to  primary-3217 /tmp/detox.primary-3217  :  reportTestResults , {
  testResults: [
    {
      success: false,
      testFilePath: '/Users/priyaranganathan/Documents/React_Native_Projects/FakeStore/e2e/starter.test.js',
      testExecError: undefined,
      isPermanentFailure: false
    }
  ]
}
13:05:56.316 detox[3217] [90mi[39m received event of :  reportTestResults {
  testResults: [
    {
      success: false,
      testFilePath: '/Users/priyaranganathan/Documents/React_Native_Projects/FakeStore/e2e/starter.test.js',
      isPermanentFailure: false
    }
  ]
}
13:05:56.316 detox[3217] [90mi[39m dispatching event to socket  :  reportTestResultsDone {
  testResults: [
    {
      success: false,
      testFilePath: '/Users/priyaranganathan/Documents/React_Native_Projects/FakeStore/e2e/starter.test.js',
      isPermanentFailure: false
    }
  ]
}
13:05:56.316 detox[3217] [90mi[39m broadcasting event to all known sockets listening to  /tmp/detox.primary-3217  :   sessionStateUpdate {
  testResults: [
    {
      success: false,
      testFilePath: '/Users/priyaranganathan/Documents/React_Native_Projects/FakeStore/e2e/starter.test.js',
      isPermanentFailure: false
    }
  ]
}
13:05:56.317 detox[3218] [90mi[39m ## received events ##
13:05:56.317 detox[3218] [90mi[39m detected event reportTestResultsDone {
  testResults: [
    {
      success: false,
      testFilePath: '/Users/priyaranganathan/Documents/React_Native_Projects/FakeStore/e2e/starter.test.js',
      isPermanentFailure: false
    }
  ]
}
13:05:56.320 detox[3217] [90mi[39m socket disconnected secondary-3218
13:05:56.320 detox[3218] [90mi[39m connection closed primary-3217 /tmp/detox.primary-3217 0 tries remaining of 0
13:05:56.320 detox[3218] [90mi[39m secondary-3218 exceeded connection rety amount of  or stopRetrying flag set.
13:05:56.332 detox[3218] [90mi[39m 
13:05:56.399 detox[3217] [90mE[39m Command failed with exit code = 1:
jest --config e2e/jest.config.js
13:05:56.400 detox[3217] [90mi[39m Detox server has been closed gracefully
13:05:56.401 detox[3217] [90mi[39m app exited session b68d03b6-79de-b9fa-53d8-a0e9567c759f
13:05:56.401 detox[3217] [90mE[39m connection :51472<->:51538
13:05:56.402 detox[3217] [90mE[39m node_modules/.bin/detox test --configuration android.att.debug --record-logs all
