13:09:03.460 detox[3438] [90mB[39m node_modules/.bin/detox test --configuration android.att.debug --record-logs all
  data: {
    "id": "3cb8cfc9-8e96-2a47-3ef3-43fd693a88b9",
    "detoxConfig": {
      "configurationName": "android.att.debug",
      "apps": {
        "default": {
          "type": "android.apk",
          "binaryPath": "android/app/build/outputs/apk/debug/app-debug.apk",
          "build": "cd android && ./gradlew assembleDebug assembleAndroidTest -DtestBuildType=debug",
          "reversePorts": [
            8081
          ]
        }
      },
      "artifacts": {
        "rootDir": "artifacts/android.att.debug.2023-05-19 07-39-03Z",
        "plugins": {
          "log": {
            "enabled": true,
            "keepOnlyFailedTestsArtifacts": false
          },
          "screenshot": {
            "enabled": true,
            "shouldTakeAutomaticSnapshots": false,
            "keepOnlyFailedTestsArtifacts": false
          },
          "video": {
            "enabled": false,
            "keepOnlyFailedTestsArtifacts": false
          },
          "instruments": {
            "enabled": false,
            "keepOnlyFailedTestsArtifacts": false
          },
          "uiHierarchy": {
            "enabled": false,
            "keepOnlyFailedTestsArtifacts": false
          }
        }
      },
      "behavior": {
        "init": {
          "keepLockFile": false,
          "reinstallApp": true,
          "exposeGlobals": true
        },
        "cleanup": {
          "shutdownDevice": false
        },
        "launchApp": "auto"
      },
      "cli": {
        "recordLogs": "all",
        "configuration": "android.att.debug",
        "start": true
      },
      "device": {
        "type": "android.attached",
        "device": {
          "adbName": ".*"
        }
      },
      "logger": {
        "level": "info",
        "overrideConsole": true,
        "options": {
          "showLoggerName": true,
          "showPid": true,
          "showLevel": false,
          "showMetadata": false,
          "basepath": "/Users/priyaranganathan/Documents/React_Native_Projects/FakeStore/node_modules/detox/src",
          "prefixers": {},
          "stringifiers": {}
        }
      },
      "testRunner": {
        "retries": 0,
        "forwardEnv": false,
        "bail": false,
        "jest": {
          "setupTimeout": 120000,
          "teardownTimeout": 30000,
          "retryAfterCircusRetries": false,
          "reportWorkerAssign": true
        },
        "args": {
          "$0": "jest",
          "_": [],
          "config": "e2e/jest.config.js",
          "--": []
        }
      },
      "session": {
        "autoStart": true,
        "debugSynchronization": 10000
      }
    },
    "detoxIPCServer": "primary-3438",
    "testResults": [],
    "testSessionIndex": 0,
    "workersCount": 0
  }
13:09:03.465 detox[3438] [90mi[39m Server path not specified, so defaulting to ipc.config.socketRoot + ipc.config.appspace + ipc.config.id /tmp/detox.primary-3438
13:09:03.467 detox[3438] [90mi[39m starting server on  /tmp/detox.primary-3438 
13:09:03.467 detox[3438] [90mi[39m starting TLS server false
13:09:03.467 detox[3438] [90mi[39m starting server as Unix || Windows Socket
13:09:03.472 detox[3438] [90mi[39m Detox server listening on localhost:51771...
13:09:03.477 detox[3438] [90mi[39m Serialized the session state at: /private/var/folders/nh/qgcf94bd36j7y52qsksxp38r0000gn/T/3cb8cfc9-8e96-2a47-3ef3-43fd693a88b9.detox.json
13:09:03.478 detox[3438] [90mB[39m jest --config e2e/jest.config.js
13:09:04.034 detox[3439] [90mi[39m Service path not specified, so defaulting to ipc.config.socketRoot + ipc.config.appspace + id 
13:09:04.035 detox[3439] [90mi[39m requested connection to  primary-3438 /tmp/detox.primary-3438
13:09:04.035 detox[3439] [90mi[39m Connecting client on Unix Socket : /tmp/detox.primary-3438
13:09:04.036 detox[3438] [90mi[39m ## socket connection to server detected ##
13:09:04.036 detox[3439] [90mi[39m retrying reset
13:09:04.037 detox[3439] [90mi[39m dispatching event to  primary-3438 /tmp/detox.primary-3438  :  registerContext , { id: 'secondary-3439' }
13:09:04.039 detox[3438] [90mi[39m received event of :  registerContext { id: 'secondary-3439' }
13:09:04.039 detox[3438] [90mi[39m dispatching event to socket  :  registerContextDone { testResults: [], testSessionIndex: 0 }
13:09:04.039 detox[3439] [90mi[39m ## received events ##
13:09:04.040 detox[3439] [90mi[39m detected event registerContextDone { testResults: [], testSessionIndex: 0 }
13:09:04.100 detox[3439] [90mB[39m e2e/starter.test.js
13:09:04.110 detox[3439] [90mB[39m set up environment
13:09:04.111 detox[3438] [90mi[39m received event of :  registerWorker { workerId: 'w1' }
13:09:04.111 detox[3438] [90mi[39m dispatching event to socket  :  registerWorkerDone { workersCount: 1 }
13:09:04.111 detox[3439] [90mi[39m dispatching event to  primary-3438 /tmp/detox.primary-3438  :  registerWorker , { workerId: 'w1' }
13:09:04.112 detox[3438] [90mi[39m broadcasting event to all known sockets listening to  /tmp/detox.primary-3438  :   sessionStateUpdate { workersCount: 1 }
13:09:04.112 detox[3439] [90mi[39m ## received events ##
13:09:04.112 detox[3439] [90mi[39m detected event registerWorkerDone { workersCount: 1 }
13:09:04.224 detox[3439] [90mi[39m ## received events ##
13:09:04.224 detox[3439] [90mi[39m detected event sessionStateUpdate { workersCount: 1 }
13:09:04.229 detox[3438] [90mB[39m connection :51771<->:51772
13:09:04.230 detox[3439] [90mi[39m opened web socket to: ws://localhost:51771
13:09:04.233 detox[3439] [90mi[39m send message
  data: {"type":"login","params":{"sessionId":"1b33e6a7-d3f3-25c2-88ee-2242843e5b62","role":"tester"},"messageId":0}
13:09:04.234 detox[3438] [90mi[39m get
  data: {"type":"login","params":{"sessionId":"1b33e6a7-d3f3-25c2-88ee-2242843e5b62","role":"tester"},"messageId":0}
13:09:04.234 detox[3438] [90mi[39m created session 1b33e6a7-d3f3-25c2-88ee-2242843e5b62
13:09:04.235 detox[3438] [90mi[39m send
  data: {
    "type": "loginSuccess",
    "params": {
      "testerConnected": true,
      "appConnected": false
    },
    "messageId": 0
  }
13:09:04.235 detox[3438] [90mi[39m tester joined session 1b33e6a7-d3f3-25c2-88ee-2242843e5b62
13:09:04.236 detox[3439] [90mi[39m get message
  data: {"type":"loginSuccess","params":{"testerConnected":true,"appConnected":false},"messageId":0}
   
13:09:04.265 detox[3439] [90mB[39m allocate
  args: ({"type":"android.attached","device":{"adbName":".*"}})
13:09:04.267 detox[3439] [90mi[39m "/Users/priyaranganathan/Library/Android/sdk/platform-tools/adb"  devices
13:09:04.298 detox[3439] [90mi[39m List of devices attached
b6b897f1	device


13:09:04.300 detox[3439] [90mi[39m Found a matching & free device b6b897f1
13:09:04.301 detox[3439] [90mE[39m allocate
13:09:04.301 detox[3439] [90mB[39m postAllocate
  args: ({"adbName":"b6b897f1"})
13:09:04.301 detox[3439] [90mi[39m "/Users/priyaranganathan/Library/Android/sdk/platform-tools/adb" -s b6b897f1 shell "getprop ro.build.version.sdk"
13:09:04.352 detox[3439] [90mi[39m 30

13:09:04.352 detox[3439] [90mi[39m "/Users/priyaranganathan/Library/Android/sdk/platform-tools/adb" -s b6b897f1 shell "dumpsys power | grep \"^[ ]*m[UW].*=\""
13:09:04.471 detox[3439] [90mi[39m   mWakefulness=Awake
  mWakefulnessChanging=false
  mWakeLockSummary=0x0
  mUserActivitySummary=0x1
  mWakeUpWhenPluggedOrUnpluggedConfig=true
  mWakeUpWhenPluggedOrUnpluggedInTheaterModeConfig=false
  mUserActivityTimeoutOverrideFromWindowManager=-1
  mUserInactiveOverrideFromWindowManager=false
  mUserId=0

13:09:04.472 detox[3439] [90mB[39m onBootDevice
  args: ({"deviceId":"b6b897f1","type":"device","coldBoot":false})
13:09:04.472 detox[3439] [90mE[39m onBootDevice
13:09:04.472 detox[3439] [90mE[39m postAllocate
13:09:04.496 detox[3439] [90mB[39m installUtilBinaries
  args: ()
13:09:04.496 detox[3439] [90mE[39m installUtilBinaries
13:09:04.496 detox[3439] [90mB[39m selectApp
  args: ("default")
13:09:04.498 detox[3439] [90mi[39m "/Users/priyaranganathan/Library/Android/sdk/build-tools/33.0.0/aapt" dump badging "/Users/priyaranganathan/Documents/React_Native_Projects/FakeStore/android/app/build/outputs/apk/debug/app-debug.apk"
13:09:04.525 detox[3439] [90mi[39m package: name='com.fakestore' versionCode='1' versionName='1.0' platformBuildVersionName='12' platformBuildVersionCode='31' compileSdkVersion='31' compileSdkVersionCodename='12'
sdkVersion:'21'
targetSdkVersion:'31'
uses-permission: name='android.permission.SYSTEM_ALERT_WINDOW'
uses-permission: name='android.permission.INTERNET'
uses-permission: name='android.permission.CAMERA'
uses-permission: name='android.permission.WRITE_EXTERNAL_STORAGE'
uses-permission: name='android.permission.ACCESS_FINE_LOCATION'
uses-permission: name='android.permission.ACCESS_COARSE_LOCATION'
uses-permission: name='android.permission.ACCESS_WIFI_STATE'
application-label:'FakeStore'
application-label-af:'FakeStore'
application-label-am:'FakeStore'
application-label-ar:'FakeStore'
application-label-as:'FakeStore'
application-label-az:'FakeStore'
application-label-be:'FakeStore'
application-label-bg:'FakeStore'
application-label-bn:'FakeStore'
application-label-bs:'FakeStore'
application-label-ca:'FakeStore'
application-label-cs:'FakeStore'
application-label-da:'FakeStore'
application-label-de:'FakeStore'
application-label-el:'FakeStore'
application-label-en-AU:'FakeStore'
application-label-en-CA:'FakeStore'
application-label-en-GB:'FakeStore'
application-label-en-IN:'FakeStore'
application-label-en-XC:'FakeStore'
application-label-es:'FakeStore'
application-label-es-US:'FakeStore'
application-label-et:'FakeStore'
application-label-eu:'FakeStore'
application-label-fa:'FakeStore'
application-label-fi:'FakeStore'
application-label-fr:'FakeStore'
application-label-fr-CA:'FakeStore'
application-label-gl:'FakeStore'
application-label-gu:'FakeStore'
application-label-hi:'FakeStore'
application-label-hr:'FakeStore'
application-label-hu:'FakeStore'
application-label-hy:'FakeStore'
application-label-in:'FakeStore'
application-label-is:'FakeStore'
application-label-it:'FakeStore'
application-label-iw:'FakeStore'
application-label-ja:'FakeStore'
application-label-ka:'FakeStore'
application-label-kk:'FakeStore'
application-label-km:'FakeStore'
application-label-kn:'FakeStore'
application-label-ko:'FakeStore'
application-label-ky:'FakeStore'
application-label-lo:'FakeStore'
application-label-lt:'FakeStore'
application-label-lv:'FakeStore'
application-label-mk:'FakeStore'
application-label-ml:'FakeStore'
application-label-mn:'FakeStore'
application-label-mr:'FakeStore'
application-label-ms:'FakeStore'
application-label-my:'FakeStore'
application-label-nb:'FakeStore'
application-label-ne:'FakeStore'
application-label-nl:'FakeStore'
application-label-or:'FakeStore'
application-label-pa:'FakeStore'
application-label-pl:'FakeStore'
application-label-pt:'FakeStore'
application-label-pt-BR:'FakeStore'
application-label-pt-PT:'FakeStore'
application-label-ro:'FakeStore'
application-label-ru:'FakeStore'
application-label-si:'FakeStore'
application-label-sk:'FakeStore'
application-label-sl:'FakeStore'
application-label-sq:'FakeStore'
application-label-sr:'FakeStore'
application-label-sr-Latn:'FakeStore'
application-label-sv:'FakeStore'
application-label-sw:'FakeStore'
application-label-ta:'FakeStore'
application-label-te:'FakeStore'
application-label-th:'FakeStore'
application-label-tl:'FakeStore'
application-label-tr:'FakeStore'
application-label-uk:'FakeStore'
application-label-ur:'FakeStore'
application-label-uz:'FakeStore'
application-label-vi:'FakeStore'
application-label-zh-CN:'FakeStore'
application-label-zh-HK:'FakeStore'
application-label-zh-TW:'FakeStore'
application-label-zu:'FakeStore'
application-icon-160:'res/mipmap-mdpi-v4/ic_launcher.png'
application-icon-240:'res/mipmap-hdpi-v4/ic_launcher.png'
application-icon-320:'res/mipmap-xhdpi-v4/ic_launcher.png'
application-icon-480:'res/mipmap-xxhdpi-v4/ic_launcher.png'
application-icon-640:'res/mipmap-xxxhdpi-v4/ic_launcher.png'
application-icon-65534:'res/mipmap-mdpi-v4/ic_launcher.png'
application: label='FakeStore' icon='res/mipmap-mdpi-v4/ic_launcher.png'
application-debuggable
launchable-activity: name='com.fakestore.MainActivity'  label='FakeStore' icon=''
uses-permission: name='android.permission.READ_EXTERNAL_STORAGE'
uses-implied-permission: name='android.permission.READ_EXTERNAL_STORAGE' reason='requested WRITE_EXTERNAL_STORAGE'
feature-group: label=''
  uses-feature: name='android.hardware.camera'
  uses-implied-feature: name='android.hardware.camera' reason='requested android.permission.CAMERA permission'
  uses-feature: name='android.hardware.faketouch'
  uses-implied-feature: name='android.hardware.faketouch' reason='default feature for all apps'
  uses-feature: name='android.hardware.location'
  uses-implied-feature: name='android.hardware.location' reason='requested android.permission.ACCESS_COARSE_LOCATION permission, and requested android.permission.ACCESS_FINE_LOCATION permission'
  uses-feature: name='android.hardware.wifi'
  uses-implied-feature: name='android.hardware.wifi' reason='requested android.permission.ACCESS_WIFI_STATE permission'
main
other-activities
supports-screens: 'small' 'normal' 'large' 'xlarge'
supports-any-density: 'true'
locales: '--_--' 'af' 'am' 'ar' 'as' 'az' 'be' 'bg' 'bn' 'bs' 'ca' 'cs' 'da' 'de' 'el' 'en-AU' 'en-CA' 'en-GB' 'en-IN' 'en-XC' 'es' 'es-US' 'et' 'eu' 'fa' 'fi' 'fr' 'fr-CA' 'gl' 'gu' 'hi' 'hr' 'hu' 'hy' 'in' 'is' 'it' 'iw' 'ja' 'ka' 'kk' 'km' 'kn' 'ko' 'ky' 'lo' 'lt' 'lv' 'mk' 'ml' 'mn' 'mr' 'ms' 'my' 'nb' 'ne' 'nl' 'or' 'pa' 'pl' 'pt' 'pt-BR' 'pt-PT' 'ro' 'ru' 'si' 'sk' 'sl' 'sq' 'sr' 'sr-Latn' 'sv' 'sw' 'ta' 'te' 'th' 'tl' 'tr' 'uk' 'ur' 'uz' 'vi' 'zh-CN' 'zh-HK' 'zh-TW' 'zu'
densities: '160' '240' '320' '480' '640' '65534'
native-code: 'arm64-v8a' 'armeabi-v7a' 'x86' 'x86_64'

13:09:04.526 detox[3439] [90mE[39m selectApp
13:09:04.526 detox[3439] [90mB[39m uninstallApp
  args: ()
13:09:04.527 detox[3439] [90mB[39m onBeforeUninstallApp
  args: ({"deviceId":"b6b897f1","bundleId":"com.fakestore"})
13:09:04.527 detox[3439] [90mE[39m onBeforeUninstallApp
13:09:04.527 detox[3439] [90mi[39m "/Users/priyaranganathan/Library/Android/sdk/platform-tools/adb" -s b6b897f1 shell "pm list packages com.fakestore"
13:09:04.599 detox[3439] [90mi[39m package:com.fakestore.test
package:com.fakestore

13:09:04.600 detox[3439] [90mi[39m "/Users/priyaranganathan/Library/Android/sdk/platform-tools/adb" -s b6b897f1 uninstall com.fakestore
13:09:05.205 detox[3439] [90mi[39m Success

13:09:05.205 detox[3439] [90mi[39m "/Users/priyaranganathan/Library/Android/sdk/platform-tools/adb" -s b6b897f1 shell "pm list packages com.fakestore.test"
13:09:05.305 detox[3439] [90mi[39m package:com.fakestore.test

13:09:05.305 detox[3439] [90mi[39m "/Users/priyaranganathan/Library/Android/sdk/platform-tools/adb" -s b6b897f1 uninstall com.fakestore.test
13:09:06.971 detox[3439] [90mi[39m Success

13:09:06.972 detox[3439] [90mE[39m uninstallApp
13:09:06.973 detox[3439] [90mB[39m selectApp
  args: ("default")
13:09:06.976 detox[3439] [90mB[39m terminateApp
  args: ()
13:09:06.976 detox[3439] [90mB[39m onBeforeTerminateApp
  args: ({"deviceId":"b6b897f1","bundleId":"com.fakestore"})
13:09:06.977 detox[3439] [90mE[39m onBeforeTerminateApp
13:09:06.977 detox[3439] [90mi[39m "/Users/priyaranganathan/Library/Android/sdk/platform-tools/adb" -s b6b897f1 shell "am force-stop com.fakestore"
13:09:07.129 detox[3439] [90mi[39m 
13:09:07.130 detox[3439] [90mB[39m onTerminateApp
  args: ({"deviceId":"b6b897f1","bundleId":"com.fakestore"})
13:09:07.130 detox[3439] [90mE[39m onTerminateApp
13:09:07.130 detox[3439] [90mE[39m terminateApp
13:09:07.130 detox[3439] [90mE[39m selectApp
13:09:07.131 detox[3439] [90mB[39m installApp
  args: ()
13:09:07.132 detox[3439] [90mi[39m "/Users/priyaranganathan/Library/Android/sdk/build-tools/33.0.0/aapt" dump xmlstrings "/Users/priyaranganathan/Documents/React_Native_Projects/FakeStore/android/app/build/outputs/apk/debug/app-debug.apk" AndroidManifest.xml
13:09:07.173 detox[3439] [90mi[39m String pool of 63 unique UTF-16 non-sorted strings, 63 entries and 0 styles using 3000 bytes:
String #0: theme
String #1: label
String #2: icon
String #3: name
String #4: debuggable
String #5: exported
String #6: authorities
String #7: grantUriPermissions
String #8: launchMode
String #9: configChanges
String #10: value
String #11: resource
String #12: minSdkVersion
String #13: versionCode
String #14: versionName
String #15: windowSoftInputMode
String #16: targetSdkVersion
String #17: allowBackup
String #18: usesCleartextTraffic
String #19: networkSecurityConfig
String #20: roundIcon
String #21: compileSdkVersion
String #22: compileSdkVersionCodename
String #23: appComponentFactory
String #24: 1.0
String #25: 12
String #26: action
String #27: activity
String #28: android
String #29: android.intent.action.MAIN
String #30: android.intent.category.LAUNCHER
String #31: android.permission.ACCESS_COARSE_LOCATION
String #32: android.permission.ACCESS_FINE_LOCATION
String #33: android.permission.ACCESS_WIFI_STATE
String #34: android.permission.CAMERA
String #35: android.permission.INTERNET
String #36: android.permission.SYSTEM_ALERT_WINDOW
String #37: android.permission.WRITE_EXTERNAL_STORAGE
String #38: android.support.FILE_PROVIDER_PATHS
String #39: androidx.core.app.CoreComponentFactory
String #40: androidx.emoji2.text.EmojiCompatInitializer
String #41: androidx.lifecycle.ProcessLifecycleInitializer
String #42: androidx.startup
String #43: androidx.startup.InitializationProvider
String #44: application
String #45: category
String #46: com.facebook.react.devsupport.DevSettingsActivity
String #47: com.fakestore
String #48: com.fakestore.MainActivity
String #49: com.fakestore.MainApplication
String #50: com.fakestore.androidx-startup
String #51: com.fakestore.imagepickerprovider
String #52: com.imagepicker.ImagePickerProvider
String #53: http://schemas.android.com/apk/res/android
String #54: intent-filter
String #55: manifest
String #56: meta-data
String #57: package
String #58: platformBuildVersionCode
String #59: platformBuildVersionName
String #60: provider
String #61: uses-permission
String #62: uses-sdk

13:09:07.173 detox[3439] [90mi[39m "/Users/priyaranganathan/Library/Android/sdk/build-tools/33.0.0/aapt" dump xmlstrings "/Users/priyaranganathan/Documents/React_Native_Projects/FakeStore/android/app/build/outputs/apk/androidTest/debug/app-debug-androidTest.apk" AndroidManifest.xml
13:09:07.203 detox[3439] [90mi[39m String pool of 42 unique UTF-16 non-sorted strings, 42 entries and 0 styles using 2060 bytes:
String #0: theme
String #1: label
String #2: name
String #3: debuggable
String #4: exported
String #5: priority
String #6: targetPackage
String #7: handleProfiling
String #8: functionalTest
String #9: minSdkVersion
String #10: targetSdkVersion
String #11: compileSdkVersion
String #12: compileSdkVersionCodename
String #13: 12
String #14: Tests for com.fakestore
String #15: activity
String #16: android
String #17: android.intent.category.LAUNCHER
String #18: android.permission.REORDER_TASKS
String #19: android.test.runner
String #20: androidx.test.core.app.InstrumentationActivityInvoker$BootstrapActivity
String #21: androidx.test.core.app.InstrumentationActivityInvoker$EmptyActivity
String #22: androidx.test.core.app.InstrumentationActivityInvoker$EmptyFloatingActivity
String #23: androidx.test.orchestrator
String #24: androidx.test.runner.AndroidJUnitRunner
String #25: androidx.test.services
String #26: application
String #27: category
String #28: com.fakestore
String #29: com.fakestore.test
String #30: com.google.android.apps.common.testing.services
String #31: http://schemas.android.com/apk/res/android
String #32: instrumentation
String #33: intent-filter
String #34: manifest
String #35: package
String #36: platformBuildVersionCode
String #37: platformBuildVersionName
String #38: queries
String #39: uses-library
String #40: uses-permission
String #41: uses-sdk

13:09:07.213 detox[3439] [90mi[39m /Users/priyaranganathan/Library/Android/sdk/platform-tools/adb -s b6b897f1 install -r -g -t /Users/priyaranganathan/Documents/React_Native_Projects/FakeStore/android/app/build/outputs/apk/debug/app-debug.apk
13:09:11.127 detox[3439] [90mi[39m Performing Streamed Install
Success

13:09:11.133 detox[3439] [90mi[39m /Users/priyaranganathan/Library/Android/sdk/platform-tools/adb -s b6b897f1 install -r -g -t /Users/priyaranganathan/Documents/React_Native_Projects/FakeStore/android/app/build/outputs/apk/debug/app-debug.apk exited with code #0
13:09:11.151 detox[3439] [90mi[39m /Users/priyaranganathan/Library/Android/sdk/platform-tools/adb -s b6b897f1 install -r -g -t /Users/priyaranganathan/Documents/React_Native_Projects/FakeStore/android/app/build/outputs/apk/androidTest/debug/app-debug-androidTest.apk
13:09:14.558 detox[3439] [90mi[39m Performing Streamed Install
Success

13:09:14.563 detox[3439] [90mi[39m /Users/priyaranganathan/Library/Android/sdk/platform-tools/adb -s b6b897f1 install -r -g -t /Users/priyaranganathan/Documents/React_Native_Projects/FakeStore/android/app/build/outputs/apk/androidTest/debug/app-debug-androidTest.apk exited with code #0
13:09:14.564 detox[3439] [90mB[39m reverseTcpPort
  args: (8081)
13:09:14.565 detox[3439] [90mi[39m "/Users/priyaranganathan/Library/Android/sdk/platform-tools/adb" -s b6b897f1 reverse tcp:8081 tcp:8081
13:09:14.625 detox[3439] [90mi[39m 
13:09:14.625 detox[3439] [90mE[39m reverseTcpPort
13:09:14.625 detox[3439] [90mE[39m installApp
13:09:14.626 detox[3439] [90mB[39m selectApp
  args: ("default")
13:09:14.626 detox[3439] [90mB[39m terminateApp
  args: ()
13:09:14.626 detox[3439] [90mB[39m onBeforeTerminateApp
  args: ({"deviceId":"b6b897f1","bundleId":"com.fakestore"})
13:09:14.626 detox[3439] [90mE[39m onBeforeTerminateApp
13:09:14.626 detox[3439] [90mi[39m "/Users/priyaranganathan/Library/Android/sdk/platform-tools/adb" -s b6b897f1 shell "am force-stop com.fakestore"
13:09:14.952 detox[3439] [90mi[39m 
13:09:14.953 detox[3439] [90mB[39m onTerminateApp
  args: ({"deviceId":"b6b897f1","bundleId":"com.fakestore"})
13:09:14.953 detox[3439] [90mE[39m onTerminateApp
13:09:14.953 detox[3439] [90mE[39m terminateApp
13:09:14.953 detox[3439] [90mE[39m selectApp
13:09:14.955 detox[3439] [90mE[39m set up environment
13:09:15.274 detox[3439] [90mi[39m starter.test.js is assigned to AttachedDevice:b6b897f1
13:09:15.275 detox[3439] [90mB[39m run the tests
13:09:15.275 detox[3439] [90mB[39m onRunDescribeStart
  args: ({"name":"ROOT_DESCRIBE_BLOCK"})
13:09:15.276 detox[3439] [90mE[39m onRunDescribeStart
13:09:15.277 detox[3439] [90mB[39m Example
13:09:15.277 detox[3439] [90mB[39m onRunDescribeStart
  args: ({"name":"Example"})
13:09:15.277 detox[3439] [90mE[39m onRunDescribeStart
13:09:15.277 detox[3439] [90mB[39m beforeAll
13:09:15.282 detox[3439] [90mB[39m launchApp
  args: ()
13:09:15.282 detox[3439] [90mB[39m terminateApp
  args: ("com.fakestore")
13:09:15.282 detox[3439] [90mB[39m onBeforeTerminateApp
  args: ({"deviceId":"b6b897f1","bundleId":"com.fakestore"})
13:09:15.282 detox[3439] [90mE[39m onBeforeTerminateApp
13:09:15.283 detox[3439] [90mi[39m "/Users/priyaranganathan/Library/Android/sdk/platform-tools/adb" -s b6b897f1 shell "am force-stop com.fakestore"
13:09:15.399 detox[3439] [90mi[39m 
13:09:15.399 detox[3439] [90mB[39m onTerminateApp
  args: ({"deviceId":"b6b897f1","bundleId":"com.fakestore"})
13:09:15.399 detox[3439] [90mE[39m onTerminateApp
13:09:15.399 detox[3439] [90mE[39m terminateApp
13:09:15.400 detox[3439] [90mB[39m onBeforeLaunchApp
  args: ({"deviceId":"b6b897f1","bundleId":"com.fakestore","launchArgs":{"detoxServer":"ws://localhost:51771","detoxSessionId":"1b33e6a7-d3f3-25c2-88ee-2242843e5b62"}})
13:09:15.400 detox[3439] [90mi[39m "/Users/priyaranganathan/Library/Android/sdk/platform-tools/adb" -s b6b897f1 shell "date +\"%m-%d %T.000\""
13:09:15.483 detox[3439] [90mi[39m 05-19 13:09:13.000

13:09:15.483 detox[3439] [90mE[39m onBeforeLaunchApp
13:09:15.484 detox[3439] [90mi[39m "/Users/priyaranganathan/Library/Android/sdk/platform-tools/adb" -s b6b897f1 reverse tcp:51771 tcp:51771
13:09:15.518 detox[3439] [90mi[39m 51771

13:09:15.519 detox[3439] [90mi[39m "/Users/priyaranganathan/Library/Android/sdk/platform-tools/adb" -s b6b897f1 shell "pm list instrumentation"
13:09:15.600 detox[3439] [90mi[39m instrumentation:com.fakestore.test/androidx.test.runner.AndroidJUnitRunner (target=com.fakestore)

13:09:15.609 detox[3439] [90mi[39m /Users/priyaranganathan/Library/Android/sdk/platform-tools/adb -s b6b897f1 shell am instrument -w -r -e detoxServer ws://localhost:51771 -e detoxSessionId 1b33e6a7-d3f3-25c2-88ee-2242843e5b62 -e debug false com.fakestore.test/androidx.test.runner.AndroidJUnitRunner
13:09:16.115 detox[3439] [90mi[39m "/Users/priyaranganathan/Library/Android/sdk/platform-tools/adb" -s b6b897f1 shell "ps | grep \"com\.fakestore$\""
13:09:16.293 detox[3439] [90mi[39m u0_a1039       7153    951 5855108 132192 0                   0 R com.fakestore

13:09:16.294 detox[3439] [90mB[39m onLaunchApp
  args: ({"deviceId":"b6b897f1","bundleId":"com.fakestore","launchArgs":{"detoxServer":"ws://localhost:51771","detoxSessionId":"1b33e6a7-d3f3-25c2-88ee-2242843e5b62"},"pid":7153})
13:09:16.296 detox[3439] [90mi[39m starting ADBLogcatRecording
13:09:16.311 detox[3439] [90mi[39m /Users/priyaranganathan/Library/Android/sdk/platform-tools/adb -s b6b897f1 shell "logcat -T \"05-19 13:09:13.000\" --pid=7153 -f /sdcard/1394260_0.log"
13:09:16.312 detox[3439] [90mE[39m onLaunchApp
13:09:16.615 detox[3439] [90mi[39m "/Users/priyaranganathan/Library/Android/sdk/platform-tools/adb" -s b6b897f1 shell du /sdcard/1394260_0.log
13:09:16.699 detox[3439] [90mi[39m 16	/sdcard/1394260_0.log

13:09:17.134 detox[3439] [90mi[39m INSTRUMENTATION_STATUS: class=com.fakestore.DetoxTest
INSTRUMENTATION_STATUS: current=1
INSTRUMENTATION_STATUS: id=AndroidJUnitRunner
INSTRUMENTATION_STATUS: numtests=1
INSTRUMENTATION_STATUS: stream=
com.fakestore.DetoxTest:
INSTRUMENTATION_STATUS: test=runDetoxTests
INSTRUMENTATION_STATUS_CODE: 1

13:09:17.662 detox[3438] [90mB[39m connection :51771<->:51837
13:09:17.670 detox[3438] [90mi[39m get
  data: {"messageId":0,"type":"login","params":{"role":"app","sessionId":"1b33e6a7-d3f3-25c2-88ee-2242843e5b62"}}
13:09:17.670 detox[3438] [90mi[39m send
  data: {
    "messageId": 0,
    "type": "loginSuccess",
    "params": {
      "testerConnected": true,
      "appConnected": true
    }
  }
13:09:17.671 detox[3438] [90mi[39m app joined session 1b33e6a7-d3f3-25c2-88ee-2242843e5b62
13:09:17.671 detox[3438] [90mi[39m send
  data: {
    "type": "appConnected"
  }
13:09:17.672 detox[3439] [90mi[39m get message
  data: {"type":"appConnected"}
   
13:09:17.676 detox[3439] [90mi[39m send message
  data: {"type":"isReady","params":{},"messageId":-1000}
13:09:17.677 detox[3438] [90mi[39m get
  data: {"type":"isReady","params":{},"messageId":-1000}
13:09:17.677 detox[3438] [90mi[39m send
  data: {
    "type": "isReady",
    "params": {},
    "messageId": -1000
  }
13:09:18.777 detox[3438] [90mi[39m get
  data: {"messageId":-1000,"type":"ready","params":{}}
13:09:18.778 detox[3438] [90mi[39m send
  data: {
    "messageId": -1000,
    "type": "ready",
    "params": {}
  }
13:09:18.779 detox[3439] [90mi[39m get message
  data: {"messageId":-1000,"type":"ready","params":{}}
   
13:09:18.781 detox[3439] [90mB[39m onAppReady
  args: ({"deviceId":"b6b897f1","bundleId":"com.fakestore","pid":7153})
13:09:18.782 detox[3439] [90mE[39m onAppReady
13:09:18.782 detox[3439] [90mE[39m launchApp
13:09:18.783 detox[3439] [90mE[39m beforeAll
13:09:18.784 detox[3439] [90mB[39m should have splash screen
13:09:18.785 detox[3439] [90mi[39m Example: should have splash screen
13:09:18.787 detox[3439] [90mB[39m onTestStart
  args: ({"title":"should have splash screen","fullName":"Example should have splash screen","status":"running","invocations":1})
13:09:18.788 detox[3439] [90mi[39m stopping ADBLogcatRecording
13:09:18.789 detox[3439] [90mi[39m "/Users/priyaranganathan/Library/Android/sdk/platform-tools/adb" -s b6b897f1 shell "date +\"%m-%d %T.000\""
13:09:18.816 detox[3438] [90mi[39m get
  data: {"messageId":-1000,"type":"ready","params":{}}
13:09:18.816 detox[3438] [90mi[39m send
  data: {
    "messageId": -1000,
    "type": "ready",
    "params": {}
  }
13:09:18.817 detox[3439] [90mi[39m get message
  data: {"messageId":-1000,"type":"ready","params":{}}
   
13:09:18.871 detox[3439] [90mi[39m 05-19 13:09:17.000

13:09:18.873 detox[3439] [90mi[39m sending SIGINT to: /Users/priyaranganathan/Library/Android/sdk/platform-tools/adb -s b6b897f1 shell logcat -T "05-19 13:09:13.000" --pid=7153 -f /sdcard/1394260_0.log
13:09:18.875 detox[3439] [90mi[39m /Users/priyaranganathan/Library/Android/sdk/platform-tools/adb -s b6b897f1 shell "logcat -T \"05-19 13:09:13.000\" --pid=7153 -f /sdcard/1394260_0.log" terminated with SIGINT
13:09:18.875 detox[3439] [90mi[39m starting ADBLogcatRecording
13:09:18.884 detox[3439] [90mi[39m /Users/priyaranganathan/Library/Android/sdk/platform-tools/adb -s b6b897f1 shell "logcat -T \"05-19 13:09:17.000\" --pid=7153 -f /sdcard/1394260_1.log"
13:09:18.885 detox[3439] [90mE[39m onTestStart
13:09:18.885 detox[3439] [90mB[39m beforeEach
13:09:18.885 detox[3439] [90mE[39m beforeEach
13:09:18.885 detox[3439] [90mB[39m test_fn
13:09:18.888 detox[3439] [90mi[39m send message
  data: {"type":"invoke","params":{"target":{"type":"Class","value":"com.wix.detox.espresso.DetoxAssertion"},"method":"waitForAssertMatcher","args":[{"type":"Invocation","value":{"target":{"type":"Class","value":"androidx.test.espresso.Espresso"},"method":"onView","args":[{"type":"Invocation","value":{"target":{"type":"Class","value":"com.wix.detox.espresso.DetoxMatcher"},"method":"matcherForText","args":["Fake Store"]}}]}},{"type":"Invocation","value":{"target":{"type":"Class","value":"com.wix.detox.espresso.DetoxMatcher"},"method":"matcherForSufficientlyVisible","args":[{"type":"Integer","value":75}]}},{"type":"Double","value":2}]},"messageId":1}
13:09:18.889 detox[3438] [90mi[39m get
  data: {"type":"invoke","params":{"target":{"type":"Class","value":"com.wix.detox.espresso.DetoxAssertion"},"method":"waitForAssertMatcher","args":[{"type":"Invocation","value":{"target":{"type":"Class","value":"androidx.test.espresso.Espresso"},"method":"onView","args":[{"type":"Invocation","value":{"target":{"type":"Class","value":"com.wix.detox.espresso.DetoxMatcher"},"method":"matcherForText","args":["Fake Store"]}}]}},{"type":"Invocation","value":{"target":{"type":"Class","value":"com.wix.detox.espresso.DetoxMatcher"},"method":"matcherForSufficientlyVisible","args":[{"type":"Integer","value":75}]}},{"type":"Double","value":2}]},"messageId":1}
13:09:18.889 detox[3438] [90mi[39m send
  data: {
    "type": "invoke",
    "params": {
      "target": {
        "type": "Class",
        "value": "com.wix.detox.espresso.DetoxAssertion"
      },
      "method": "waitForAssertMatcher",
      "args": [
        {
          "type": "Invocation",
          "value": {
            "target": {
              "type": "Class",
              "value": "androidx.test.espresso.Espresso"
            },
            "method": "onView",
            "args": [
              {
                "type": "Invocation",
                "value": {
                  "target": {
                    "type": "Class",
                    "value": "com.wix.detox.espresso.DetoxMatcher"
                  },
                  "method": "matcherForText",
                  "args": [
                    "Fake Store"
                  ]
                }
              }
            ]
          }
        },
        {
          "type": "Invocation",
          "value": {
            "target": {
              "type": "Class",
              "value": "com.wix.detox.espresso.DetoxMatcher"
            },
            "method": "matcherForSufficientlyVisible",
            "args": [
              {
                "type": "Integer",
                "value": 75
              }
            ]
          }
        },
        {
          "type": "Double",
          "value": 2
        }
      ]
    },
    "messageId": 1
  }
13:09:18.889 detox[3439] [90mB[39m undefined with timeout (2000 ms)
  data: {
    "target": {
      "type": "Class",
      "value": "com.wix.detox.espresso.DetoxAssertion"
    },
    "method": "waitForAssertMatcher",
    "args": [
      {
        "type": "Invocation",
        "value": {
          "target": {
            "type": "Class",
            "value": "androidx.test.espresso.Espresso"
          },
          "method": "onView",
          "args": [
            {
              "type": "Invocation",
              "value": {
                "target": {
                  "type": "Class",
                  "value": "com.wix.detox.espresso.DetoxMatcher"
                },
                "method": "matcherForText",
                "args": [
                  "Fake Store"
                ]
              }
            }
          ]
        }
      },
      {
        "type": "Invocation",
        "value": {
          "target": {
            "type": "Class",
            "value": "com.wix.detox.espresso.DetoxMatcher"
          },
          "method": "matcherForSufficientlyVisible",
          "args": [
            {
              "type": "Integer",
              "value": 75
            }
          ]
        }
      },
      {
        "type": "Double",
        "value": 2
      }
    ]
  }
13:09:19.148 detox[3438] [90mi[39m get
  data: {"messageId":1,"type":"invokeResult","params":{"result":null}}
13:09:19.148 detox[3438] [90mi[39m send
  data: {
    "messageId": 1,
    "type": "invokeResult",
    "params": {
      "result": null
    }
  }
13:09:19.150 detox[3439] [90mi[39m get message
  data: {"messageId":1,"type":"invokeResult","params":{"result":null}}
   
13:09:19.152 detox[3439] [90mE[39m undefined with timeout (2000 ms)
13:09:19.156 detox[3439] [90mi[39m send message
  data: {"type":"invoke","params":{"target":{"type":"Class","value":"com.wix.detox.espresso.DetoxAssertion"},"method":"waitForAssertMatcher","args":[{"type":"Invocation","value":{"target":{"type":"Class","value":"androidx.test.espresso.Espresso"},"method":"onView","args":[{"type":"Invocation","value":{"target":{"type":"Class","value":"com.wix.detox.espresso.DetoxMatcher"},"method":"matcherForText","args":["Find your Gadget"]}}]}},{"type":"Invocation","value":{"target":{"type":"Class","value":"com.wix.detox.espresso.DetoxMatcher"},"method":"matcherForSufficientlyVisible","args":[{"type":"Integer","value":75}]}},{"type":"Double","value":2}]},"messageId":2}
13:09:19.157 detox[3438] [90mi[39m get
  data: {"type":"invoke","params":{"target":{"type":"Class","value":"com.wix.detox.espresso.DetoxAssertion"},"method":"waitForAssertMatcher","args":[{"type":"Invocation","value":{"target":{"type":"Class","value":"androidx.test.espresso.Espresso"},"method":"onView","args":[{"type":"Invocation","value":{"target":{"type":"Class","value":"com.wix.detox.espresso.DetoxMatcher"},"method":"matcherForText","args":["Find your Gadget"]}}]}},{"type":"Invocation","value":{"target":{"type":"Class","value":"com.wix.detox.espresso.DetoxMatcher"},"method":"matcherForSufficientlyVisible","args":[{"type":"Integer","value":75}]}},{"type":"Double","value":2}]},"messageId":2}
13:09:19.157 detox[3438] [90mi[39m send
  data: {
    "type": "invoke",
    "params": {
      "target": {
        "type": "Class",
        "value": "com.wix.detox.espresso.DetoxAssertion"
      },
      "method": "waitForAssertMatcher",
      "args": [
        {
          "type": "Invocation",
          "value": {
            "target": {
              "type": "Class",
              "value": "androidx.test.espresso.Espresso"
            },
            "method": "onView",
            "args": [
              {
                "type": "Invocation",
                "value": {
                  "target": {
                    "type": "Class",
                    "value": "com.wix.detox.espresso.DetoxMatcher"
                  },
                  "method": "matcherForText",
                  "args": [
                    "Find your Gadget"
                  ]
                }
              }
            ]
          }
        },
        {
          "type": "Invocation",
          "value": {
            "target": {
              "type": "Class",
              "value": "com.wix.detox.espresso.DetoxMatcher"
            },
            "method": "matcherForSufficientlyVisible",
            "args": [
              {
                "type": "Integer",
                "value": 75
              }
            ]
          }
        },
        {
          "type": "Double",
          "value": 2
        }
      ]
    },
    "messageId": 2
  }
13:09:19.158 detox[3439] [90mB[39m undefined with timeout (2000 ms)
  data: {
    "target": {
      "type": "Class",
      "value": "com.wix.detox.espresso.DetoxAssertion"
    },
    "method": "waitForAssertMatcher",
    "args": [
      {
        "type": "Invocation",
        "value": {
          "target": {
            "type": "Class",
            "value": "androidx.test.espresso.Espresso"
          },
          "method": "onView",
          "args": [
            {
              "type": "Invocation",
              "value": {
                "target": {
                  "type": "Class",
                  "value": "com.wix.detox.espresso.DetoxMatcher"
                },
                "method": "matcherForText",
                "args": [
                  "Find your Gadget"
                ]
              }
            }
          ]
        }
      },
      {
        "type": "Invocation",
        "value": {
          "target": {
            "type": "Class",
            "value": "com.wix.detox.espresso.DetoxMatcher"
          },
          "method": "matcherForSufficientlyVisible",
          "args": [
            {
              "type": "Integer",
              "value": 75
            }
          ]
        }
      },
      {
        "type": "Double",
        "value": 2
      }
    ]
  }
13:09:19.186 detox[3439] [90mi[39m "/Users/priyaranganathan/Library/Android/sdk/platform-tools/adb" -s b6b897f1 shell du /sdcard/1394260_1.log
13:09:19.279 detox[3439] [90mi[39m 8	/sdcard/1394260_1.log

13:09:21.542 detox[3438] [90mi[39m get
  data: {"messageId":2,"type":"testFailed","params":{"details":"2.0sec timeout expired without matching of given matcher: (view has effective visibility <VISIBLE> and view.getGlobalVisibleRect() covers at least <75> percent of the view's area)"}}
13:09:21.543 detox[3438] [90mi[39m send
  data: {
    "messageId": 2,
    "type": "testFailed",
    "params": {
      "details": "2.0sec timeout expired without matching of given matcher: (view has effective visibility <VISIBLE> and view.getGlobalVisibleRect() covers at least <75> percent of the view's area)"
    }
  }
13:09:21.545 detox[3439] [90mi[39m get message
  data: {"messageId":2,"type":"testFailed","params":{"details":"2.0sec timeout expired without matching of given matcher: (view has effective visibility <VISIBLE> and view.getGlobalVisibleRect() covers at least <75> percent of the view's area)"}}
   
13:09:21.548 detox[3439] [90mE[39m undefined with timeout (2000 ms)
  error: Test Failed: 2.0sec timeout expired without matching of given matcher: (view has effective visibility <VISIBLE> and view.getGlobalVisibleRect() covers at least <75> percent of the view's area)
13:09:21.550 detox[3439] [90mB[39m onTestFnFailure
  args: ({"error":{"name":"DetoxRuntimeError"}})
13:09:21.550 detox[3439] [90mE[39m onTestFnFailure
13:09:21.551 detox[3439] [90mE[39m test_fn
  error: Test Failed: 2.0sec timeout expired without matching of given matcher: (view has effective visibility <VISIBLE> and view.getGlobalVisibleRect() covers at least <75> percent of the view's area)
13:09:21.553 detox[3439] [90mB[39m onTestDone
  args: ({"title":"should have splash screen","fullName":"Example should have splash screen","status":"failed","invocations":1,"timedOut":false})
13:09:21.554 detox[3439] [90mi[39m stopping ADBLogcatRecording
13:09:21.554 detox[3439] [90mi[39m "/Users/priyaranganathan/Library/Android/sdk/platform-tools/adb" -s b6b897f1 shell "date +\"%m-%d %T.000\""
13:09:21.632 detox[3439] [90mi[39m 05-19 13:09:19.000

13:09:21.634 detox[3439] [90mi[39m sending SIGINT to: /Users/priyaranganathan/Library/Android/sdk/platform-tools/adb -s b6b897f1 shell logcat -T "05-19 13:09:17.000" --pid=7153 -f /sdcard/1394260_1.log
13:09:21.636 detox[3439] [90mi[39m /Users/priyaranganathan/Library/Android/sdk/platform-tools/adb -s b6b897f1 shell "logcat -T \"05-19 13:09:17.000\" --pid=7153 -f /sdcard/1394260_1.log" terminated with SIGINT
13:09:21.640 detox[3439] [90mE[39m onTestDone
13:09:21.640 detox[3439] [90mE[39m should have splash screen
13:09:21.641 detox[3439] [90mi[39m Example: should have splash screen [FAIL]
13:09:21.644 detox[3439] [90mB[39m onRunDescribeFinish
  args: ({"name":"Example"})
13:09:21.644 detox[3439] [90mE[39m onRunDescribeFinish
13:09:21.644 detox[3439] [90mE[39m Example
13:09:21.644 detox[3439] [90mB[39m onRunDescribeFinish
  args: ({"name":"ROOT_DESCRIBE_BLOCK"})
13:09:21.645 detox[3439] [90mE[39m onRunDescribeFinish
13:09:21.645 detox[3439] [90mE[39m run the tests
13:09:21.702 detox[3439] [90mB[39m tear down environment
13:09:21.703 detox[3439] [90mB[39m onBeforeCleanup
  args: ()
13:09:21.703 detox[3439] [90mi[39m saving ADBLogcatRecording to: artifacts/android.att.debug.2023-05-19 07-39-03Z/✗ Example should have splash screen/device.log
13:09:21.703 detox[3439] [90mi[39m "/Users/priyaranganathan/Library/Android/sdk/platform-tools/adb" -s b6b897f1 pull "/sdcard/1394260_1.log" "artifacts/android.att.debug.2023-05-19 07-39-03Z/✗ Example should have splash screen/device.log"
13:09:21.738 detox[3439] [90mi[39m /sdcard/1394260_1.log: 1 file pulled, 0 skipped. 5.2 MB/s (11731 bytes in 0.002s)

13:09:21.739 detox[3439] [90mi[39m "/Users/priyaranganathan/Library/Android/sdk/platform-tools/adb" -s b6b897f1 shell "rm  \"/sdcard/1394260_1.log\""
13:09:21.799 detox[3439] [90mi[39m 
13:09:21.800 detox[3439] [90mi[39m saving ADBLogcatRecording to: artifacts/android.att.debug.2023-05-19 07-39-03Z/b6b897f1 2023-05-19 07-39-21Z.startup.log
13:09:21.800 detox[3439] [90mi[39m "/Users/priyaranganathan/Library/Android/sdk/platform-tools/adb" -s b6b897f1 pull "/sdcard/1394260_0.log" "artifacts/android.att.debug.2023-05-19 07-39-03Z/b6b897f1 2023-05-19 07-39-21Z.startup.log"
13:09:21.842 detox[3439] [90mi[39m /sdcard/1394260_0.log: 1 file pulled, 0 skipped. 12.8 MB/s (36289 bytes in 0.003s)

13:09:21.843 detox[3439] [90mi[39m "/Users/priyaranganathan/Library/Android/sdk/platform-tools/adb" -s b6b897f1 shell "rm  \"/sdcard/1394260_0.log\""
13:09:21.906 detox[3439] [90mi[39m 
13:09:21.907 detox[3439] [90mi[39m saving FileArtifact to: artifacts/android.att.debug.2023-05-19 07-39-03Z/detox_pid_3439.json.log { append: true }
13:09:21.907 detox[3439] [90mi[39m saving FileArtifact to: artifacts/android.att.debug.2023-05-19 07-39-03Z/detox_pid_3439.log { append: true }
13:09:21.907 detox[3439] [90mE[39m onBeforeCleanup
13:09:21.909 detox[3438] [90mi[39m get
  data: {"type":"cleanup","params":{"stopRunner":false},"messageId":-49642}
13:09:21.909 detox[3438] [90mi[39m send
  data: {
    "type": "cleanup",
    "params": {
      "stopRunner": false
    },
    "messageId": -49642
  }
13:09:21.909 detox[3439] [90mi[39m send message
  data: {"type":"cleanup","params":{"stopRunner":false},"messageId":-49642}
13:09:21.912 detox[3438] [90mi[39m get
  data: {"messageId":-49642,"type":"cleanupDone","params":{}}
13:09:21.912 detox[3438] [90mi[39m send
  data: {
    "messageId": -49642,
    "type": "cleanupDone",
    "params": {}
  }
13:09:21.912 detox[3439] [90mi[39m get message
  data: {"messageId":-49642,"type":"cleanupDone","params":{}}
   
13:09:21.915 detox[3438] [90mi[39m tester exited session 1b33e6a7-d3f3-25c2-88ee-2242843e5b62
13:09:21.915 detox[3438] [90mi[39m send
  data: {
    "type": "testerDisconnected",
    "messageId": -1
  }
13:09:21.916 detox[3438] [90mE[39m connection :51771<->:51772
13:09:21.917 detox[3439] [90mi[39m sending SIGINT to: /Users/priyaranganathan/Library/Android/sdk/platform-tools/adb -s b6b897f1 shell am instrument -w -r -e detoxServer ws://localhost:51771 -e detoxSessionId 1b33e6a7-d3f3-25c2-88ee-2242843e5b62 -e debug false com.fakestore.test/androidx.test.runner.AndroidJUnitRunner
13:09:21.918 detox[3439] [90mi[39m /Users/priyaranganathan/Library/Android/sdk/platform-tools/adb -s b6b897f1 shell am instrument -w -r -e detoxServer ws://localhost:51771 -e detoxSessionId 1b33e6a7-d3f3-25c2-88ee-2242843e5b62 -e debug false com.fakestore.test/androidx.test.runner.AndroidJUnitRunner terminated with SIGINT
13:09:21.919 detox[3439] [90mi[39m "/Users/priyaranganathan/Library/Android/sdk/platform-tools/adb" -s b6b897f1 reverse --remove tcp:51771
13:09:21.927 detox[3439] [90mB[39m free
  args: ({"adbName":"b6b897f1"}, {"shutdown":false})
13:09:21.928 detox[3439] [90mE[39m free
13:09:21.928 detox[3439] [90mE[39m tear down environment
13:09:21.928 detox[3439] [90mE[39m e2e/starter.test.js
13:09:21.933 detox[3439] [90mi[39m dispatching event to  primary-3438 /tmp/detox.primary-3438  :  reportTestResults , {
  testResults: [
    {
      success: false,
      testFilePath: '/Users/priyaranganathan/Documents/React_Native_Projects/FakeStore/e2e/starter.test.js',
      testExecError: undefined,
      isPermanentFailure: false
    }
  ]
}
13:09:21.934 detox[3438] [90mi[39m received event of :  reportTestResults {
  testResults: [
    {
      success: false,
      testFilePath: '/Users/priyaranganathan/Documents/React_Native_Projects/FakeStore/e2e/starter.test.js',
      isPermanentFailure: false
    }
  ]
}
13:09:21.935 detox[3438] [90mi[39m dispatching event to socket  :  reportTestResultsDone {
  testResults: [
    {
      success: false,
      testFilePath: '/Users/priyaranganathan/Documents/React_Native_Projects/FakeStore/e2e/starter.test.js',
      isPermanentFailure: false
    }
  ]
}
13:09:21.935 detox[3438] [90mi[39m broadcasting event to all known sockets listening to  /tmp/detox.primary-3438  :   sessionStateUpdate {
  testResults: [
    {
      success: false,
      testFilePath: '/Users/priyaranganathan/Documents/React_Native_Projects/FakeStore/e2e/starter.test.js',
      isPermanentFailure: false
    }
  ]
}
13:09:21.935 detox[3439] [90mi[39m ## received events ##
13:09:21.936 detox[3439] [90mi[39m detected event reportTestResultsDone {
  testResults: [
    {
      success: false,
      testFilePath: '/Users/priyaranganathan/Documents/React_Native_Projects/FakeStore/e2e/starter.test.js',
      isPermanentFailure: false
    }
  ]
}
13:09:21.938 detox[3438] [90mi[39m socket disconnected secondary-3439
13:09:21.938 detox[3439] [90mi[39m connection closed primary-3438 /tmp/detox.primary-3438 0 tries remaining of 0
13:09:21.938 detox[3439] [90mi[39m secondary-3439 exceeded connection rety amount of  or stopRetrying flag set.
13:09:21.954 detox[3439] [90mi[39m 
13:09:22.047 detox[3438] [90mE[39m Command failed with exit code = 1:
jest --config e2e/jest.config.js
13:09:22.048 detox[3438] [90mi[39m Detox server has been closed gracefully
13:09:22.049 detox[3438] [90mi[39m app exited session 1b33e6a7-d3f3-25c2-88ee-2242843e5b62
13:09:22.049 detox[3438] [90mE[39m connection :51771<->:51837
13:09:22.050 detox[3438] [90mE[39m node_modules/.bin/detox test --configuration android.att.debug --record-logs all
